Predicate ID,Triple,Sentence ID,Sentence,Is Correct,Question,Answer
18897327,Ivabradine treats congestive heart failure,16,Symptomatic Bradycardia and Heart Failure Triggered by Ivabradine in a Patient Receiving Antiretroviral Therapy.,False,Is the triple 'Ivabradine treats congestive heart failure' supported by the sentence: 'Symptomatic Bradycardia and Heart Failure Triggered by Ivabradine in a Patient Receiving Antiretroviral Therapy.'?,"No, this statement does not provide direct support for the statement that Ivabradine treats congestive heart failure, as it discusses a case where Ivabradine has triggered heart failure in a patient receiving antiretroviral therapy."
16250947,Cefixime treats bacterial urinary tract infection,17,In vitro interaction between cefixime and amoxicillin-clavulanate against extended-spectrum-beta-lactamase-producing Escherichia coli causing urinary tract infection.,False,Is the triple 'Cefixime treats bacterial urinary tract infection' supported by the sentence: 'In vitro interaction between cefixime and amoxicillin-clavulanate against extended-spectrum-beta-lactamase-producing Escherichia coli causing urinary tract infection.'?,"No, this statement does not directly support that Cefixime treats bacterial urinary tract infections. It discusses an in-vitro interaction between Cefixime and Amoxicillin-Clavulanate against certain bacteria causing UTIs, but it does not confirm that Cefixime is an effective treatment for UTIs."
25663833,Ceftizoxime treats pneumonia,18,[A case of ceftizoxime-induced pneumonitis].,False,Is the triple 'Ceftizoxime treats pneumonia' supported by the sentence: '[A case of ceftizoxime-induced pneumonitis].'?,"No, it is not directly or indirectly supported, as this statement describes a single case of a patient experiencing lung inflammation (pneumonitis) after receiving Ceftizoxime treatment, which does not necessarily imply that Ceftizoxime is an effective treatment for pneumonia."
26880163,Prednisolone treats myopathy,19,"Finally, 90 min daily of endurance exercise did not antagonize prednisolone-induced myopathy in either the diaphragm or the plantaris.",False,"Is the triple 'Prednisolone treats myopathy' supported by the sentence: 'Finally, 90 min daily of endurance exercise did not antagonize prednisolone-induced myopathy in either the diaphragm or the plantaris.'?","No, it is not directly supported because the sentence mentions that prednisolone-induced myopathy is not antagonized by exercise, which could imply that prednisolone is still effective in treating myopathy regardless of exercise. However, it does not explicitly state that prednisolone treats myopathy."
26677891,Prednisolone treats uveitis,20,"Among 121 CK-analogs studied, CK-17, CK-101A and CK103A have been identified as promising anti-inflammatory agents as potent as prednisolone in inhibiting lens proteins-induced inflammation and twice as potent as prednisolone in inhibiting endotoxin-and IL-1-induced uveitis.",True,"Is the triple 'Prednisolone treats uveitis' supported by the sentence: 'Among 121 CK-analogs studied, CK-17, CK-101A and CK103A have been identified as promising anti-inflammatory agents as potent as prednisolone in inhibiting lens proteins-induced inflammation and twice as potent as prednisolone in inhibiting endotoxin-and IL-1-induced uveitis.'?","Yes, it is indirectly supported because Prednisolone is mentioned as a potent anti-inflammatory agent in treating uveitis in comparison to the new promising agents, but it does not explicitly state that Prednisolone is used to treat uveitis."
24350797,Prednisolone treats Shock,21,"Results from simulations at a fixed surface tension, representing inhalation and exhalation conditions, suggest that at high drug concentrations, prednisolone induces a collapse of the LSM, which is likely caused by the inability of the drug to diffuse into the bilayer.",False,"Is the triple 'Prednisolone treats Shock' supported by the sentence: 'Results from simulations at a fixed surface tension, representing inhalation and exhalation conditions, suggest that at high drug concentrations, prednisolone induces a collapse of the LSM, which is likely caused by the inability of the drug to diffuse into the bilayer.'?","No, it is not directly supported because it does not explicitly state that Prednisolone treats shock. However, it does suggest that Prednisolone has an effect on lung surfactant membranes (LSM) which could potentially be related to shock treatment if shock is caused by LSM collapse."
22800562,Prednisolone treats tuberculosis,22,[A case of autoimmune hepatitis with tuberculosis caused by prednisolone from undeterminable enzyme-linked immunospot assay].,False,Is the triple 'Prednisolone treats tuberculosis' supported by the sentence: '[A case of autoimmune hepatitis with tuberculosis caused by prednisolone from undeterminable enzyme-linked immunospot assay].'?,"No, this statement does not provide direct evidence that Prednisolone treats tuberculosis, nor does it imply that Prednisolone causes tuberculosis. The statement describes a case where a patient developed both autoimmune hepatitis and tuberculosis after taking Prednisolone, but it does not establish a causative relationship between Prednisolone use and the development of tuberculosis."
21449160,Prednisolone treats muscular atrophy,23,"Additionally, we demonstrate that Pred-induced muscle atrophy is not prevented by Mstn ablation.",False,"Is the triple 'Prednisolone treats muscular atrophy' supported by the sentence: 'Additionally, we demonstrate that Pred-induced muscle atrophy is not prevented by Mstn ablation.'?","No, it is not directly or indirectly supported because the provided statement discusses how Mstn ablation does not prevent Prednisolone (Presumably shortened to 'Pres' in your statement) induced muscle atrophy, which implies that Prednisolone still causes muscle atrophy even in the absence of Mstn (Myostatin). Therefore, this does not support the claim that Prednisolone treats muscular atrophy."
21293782,Prednisolone treats adrenocortical insufficiency,24,We therefore advocate for increased clinical alertness towards prednisolone-induced adrenal insufficiency in RTx patients and thus their potential need of rescue GC supplementation during stress.,True,Is the triple 'Prednisolone treats adrenocortical insufficiency' supported by the sentence: 'We therefore advocate for increased clinical alertness towards prednisolone-induced adrenal insufficiency in RTx patients and thus their potential need of rescue GC supplementation during stress.'?,"Yes, it is indirectly supported. The provided statement suggests a potential need for rescue glucocorticoid (GC) supplementation during stress in renal transplant (RTx) patients who may be experiencing prednisolone-induced adrenal insufficiency, which aligns with the statement that prednisolone treats adrenocortical insufficiency, as it is a form of glucocorticoid used to manage such conditions. However, it doesn't directly state that prednisolone is used to treat adrenocortical insufficiency in RTx patients, hence it's an indirect support."
20789636,Prednisolone treats ulcerative colitis,25,Zeaxanthin (50 mg/kg/day) or prednisolone (5 mg/kg/day) was orally administered for 14 days before induction of ulcerative colitis.,False,Is the triple 'Prednisolone treats ulcerative colitis' supported by the sentence: 'Zeaxanthin (50 mg/kg/day) or prednisolone (5 mg/kg/day) was orally administered for 14 days before induction of ulcerative colitis.'?,"No, this statement does not provide direct evidence that Prednisolone treats ulcerative colitis, as it describes a prophylactic treatment before the induction of the condition, not a treatment after its onset."
19188576,Prednisolone treats Edema,26,Prednisolone suppressed both PAF-induced and histamine-induced edema and erythema.,True,Is the triple 'Prednisolone treats Edema' supported by the sentence: 'Prednisolone suppressed both PAF-induced and histamine-induced edema and erythema.'?,"Yes, it is indirectly supported. The given sentence states that Prednisolone suppresses edema (which is a form of swelling, similar to edema), providing evidence that it can have an effect on edema conditions. However, it does not explicitly state that Prednisolone treats edema, hence it is an indirect form of support."
18869209,Prednisolone treats pulmonary fibrosis,27,"Although the mean fibrosis scores of the bleomycin + propolis and bleomycin + prednisolone groups were not significantly different, electron microscopy revealed that propolis diminished bleomycin induced lung fibrosis more effectively than prednisolone.",False,"Is the triple 'Prednisolone treats pulmonary fibrosis' supported by the sentence: 'Although the mean fibrosis scores of the bleomycin + propolis and bleomycin + prednisolone groups were not significantly different, electron microscopy revealed that propolis diminished bleomycin induced lung fibrosis more effectively than prednisolone.'?","No, it is not directly supported because the statement does not claim that prednisolone treats pulmonary fibrosis, but rather compares its effectiveness to propolis in reducing bleomycin-induced lung fibrosis, which is an indirect comparison."
16524765,Prednisolone treats osteonecrosis,28,"Evidence is less clear for prednisolone-induced osteonecrosis, obesity and hypertriglyceridaemia.",False,"Is the triple 'Prednisolone treats osteonecrosis' supported by the sentence: 'Evidence is less clear for prednisolone-induced osteonecrosis, obesity and hypertriglyceridaemia.'?","No, it's not directly supported because the sentence suggests that evidence is unclear for prednisolone-induced osteonecrosis, unlike the statement that prednisolone treats osteonecrosis. However, it could be interpreted as indirectly supporting it, as it acknowledges a link between prednisolone and osteonecrosis, even if the evidence is unclear."
16304261,Prednisolone treats nephrotic syndrome,29,[A case of nephrotic syndrome with abnormally high level of protein C induced by prednisolone].,True,Is the triple 'Prednisolone treats nephrotic syndrome' supported by the sentence: '[A case of nephrotic syndrome with abnormally high level of protein C induced by prednisolone].'?,"Yes, it is indirectly supported. The provided sentence mentions a case of nephrotic syndrome induced by prednisolone, which suggests that prednisolone can have an impact on this condition, aligning with the statement that prednisolone treats nephrotic syndrome. However, it doesn't directly state that prednisolone is used to treat nephrotic syndrome, hence it's an indirect support."
16220787,Prednisolone treats hepatitis,30,Case of prednisolone-induced hepatitis in a patient with ulcerative colitis.,False,Is the triple 'Prednisolone treats hepatitis' supported by the sentence: 'Case of prednisolone-induced hepatitis in a patient with ulcerative colitis.'?,"No, it is not directly supported because the given sentence describes a case where prednisolone caused hepatitis, not treated it."
15714230,Prednisolone treats diabetes mellitus,31,"Glucocorticoids (GCs), such as prednisolone (PRED), are widely prescribed anti-inflammatory drugs, but their use may induce glucose intolerance and diabetes.",True,"Is the triple 'Prednisolone treats diabetes mellitus' supported by the sentence: 'Glucocorticoids (GCs), such as prednisolone (PRED), are widely prescribed anti-inflammatory drugs, but their use may induce glucose intolerance and diabetes.'?","Yes, it is indirectly supported because prednisolone, a glucocorticoid, can induce glucose intolerance and potentially lead to diabetes, although it is not specifically stated that it treats diabetes mellitus."
14373522,Prednisolone treats exfoliative dermatitis,32,The erythroderma improved generally as a result of systemic prednisolone treatment.,True,Is the triple 'Prednisolone treats exfoliative dermatitis' supported by the sentence: 'The erythroderma improved generally as a result of systemic prednisolone treatment.'?,"Yes, it is indirectly supported. The improvement of the erythroderma as a result of systemic prednisolone treatment suggests that prednisolone can be an effective treatment for certain skin conditions, such as exfoliative dermatitis, which is a severe form of skin inflammation that can cause widespread redness and peeling of the skin (erythroderma). However, it's important to note that this is an inference, as the original sentence does not explicitly mention exfoliative dermatitis. Always consult a healthcare professional for medical advice."
12653424,Prednisolone treats hypertensive disorder,33,We report two cases of idiopathic nephrotic syndrome that developed ARF following captopril (an ACEI) treatment for prednisolone-induced hypertension.,False,Is the triple 'Prednisolone treats hypertensive disorder' supported by the sentence: 'We report two cases of idiopathic nephrotic syndrome that developed ARF following captopril (an ACEI) treatment for prednisolone-induced hypertension.'?,"No, it is not directly supported because it does not mention that prednisolone treats hypertension, but it could be interpreted as indirect support since prednisolone is used to manage a condition (prednisolone-induced hypertension) that led to another condition (hypertensive disorder) being treated with captopril, which then caused ARF in these patients with idiopathic nephrotic syndrome."
12012071,Prednisolone treats hyperglycemia,34,"However, prednisolone caused hyperglycemia even at a reduced dose of 10 mg/day.",True,"Is the triple 'Prednisolone treats hyperglycemia' supported by the sentence: 'However, prednisolone caused hyperglycemia even at a reduced dose of 10 mg/day.'?","Yes, it is indirectly supported. The sentence suggests that Prednisolone causes hyperglycemia, which contradicts the statement that it treats hyperglycemia."
11394683,Prednisolone treats osteoporosis,35,"Effect of D-003, a mixture of very high molecular weight aliphatic acids, on prednisolone-induced osteoporosis in Sprague-Dawley rats.",False,"Is the triple 'Prednisolone treats osteoporosis' supported by the sentence: 'Effect of D-003, a mixture of very high molecular weight aliphatic acids, on prednisolone-induced osteoporosis in Sprague-Dawley rats.'?","No, this statement does not directly support that Prednisolone treats osteoporosis. Instead, it discusses the effect of another substance (D-003) on prednisolone-induced osteoporosis in rats."
10735861,Prednisolone treats contact dermatitis,36,CONTACT DERMATITIS DUE TO TOPICAL HYDROCORTISONE AND PREDNISOLONE.,True,Is the triple 'Prednisolone treats contact dermatitis' supported by the sentence: 'CONTACT DERMATITIS DUE TO TOPICAL HYDROCORTISONE AND PREDNISOLONE.'?,"Yes, it is indirectly supported. The sentence mentions that Prednisolone can cause Contact Dermatitis, which suggests that it is used to treat Contact Dermatitis, as treatments often involve managing symptoms caused by a substance. However, it's important to note that this is a complex medical topic and a direct professional consultation is recommended for medical advice."
9924414,Prednisolone treats Marchiafava-Bignami disease,37,We carried out two experiments using a prednisolone (pred)-induced bone loss model in male (10-week-old) Fischer rats.,False,Is the triple 'Prednisolone treats Marchiafava-Bignami disease' supported by the sentence: 'We carried out two experiments using a prednisolone (pred)-induced bone loss model in male (10-week-old) Fischer rats.'?,"No, it is not directly or indirectly supported because there is no mention of Marchiafava-Bignami disease in your provided sentence, which is about an experiment involving prednisolone and bone loss in rats, not about treatments for specific diseases like Marchiafava-Bignami disease."
8757881,Prednisolone treats systemic lupus erythematosus,38,"In inactive SLE induced by prednisolone therapy, the invariant Valpha24JalphaQ TCR could be detected in DN Valpha24+ T cells from all the patients and dominated in most of the patients.",False,"Is the triple 'Prednisolone treats systemic lupus erythematosus' supported by the sentence: 'In inactive SLE induced by prednisolone therapy, the invariant Valpha24JalphaQ TCR could be detected in DN Valpha24+ T cells from all the patients and dominated in most of the patients.'?","No, this statement does not provide direct support for the claim that Prednisolone treats systemic lupus erythematosus (SLE). The sentence discusses the detection of a specific type of T-cell receptor (TCR) in patients with inactive SLE after prednisolone therapy, but it does not establish a causal relationship between prednisolone treatment and improvement of SLE symptoms, which is necessary for supporting the claim that Prednisolone is a treatment for this condition."
27073884,Hydrocortisone treats atopic eczema,39,"We report the case of a 41-year-old nonatopic women with a previous history of eczematous reaction due to hydrocortisone who suffered worsening of her perennial rhinitis in association with perinasal dermatitis from the use of budesonide in nasal spray form, and stomatitis and pharyngitis due to budesonide in a bronchial inhaler.",False,"Is the triple 'Hydrocortisone treats atopic eczema' supported by the sentence: 'We report the case of a 41-year-old nonatopic women with a previous history of eczematous reaction due to hydrocortisone who suffered worsening of her perennial rhinitis in association with perinasal dermatitis from the use of budesonide in nasal spray form, and stomatitis and pharyngitis due to budesonide in a bronchial inhaler.'?","No, this statement does not provide direct support for hydrocortisone treating atopic eczema, as it discusses an adverse reaction to budesonide, not hydrocortisone, in an individual with perennial rhinitis, perinasal dermatitis, stomatitis, and pharyngitis, not specifically atopic eczema."
26275693,Hydrocortisone treats systemic lupus erythematosus,40,Formation of covalent adducts between cortisol and 16 alpha-hydroxyestrone and protein: possible role in the pathogenesis of cortisol toxicity and systemic lupus erythematosus.,True,Is the triple 'Hydrocortisone treats systemic lupus erythematosus' supported by the sentence: 'Formation of covalent adducts between cortisol and 16 alpha-hydroxyestrone and protein: possible role in the pathogenesis of cortisol toxicity and systemic lupus erythematosus.'?,"Yes, it is indirectly supported because it mentions a possible role for cortisol (a form of hydrocortisone) in systemic lupus erythematosus, but it does not explicitly state that hydrocortisone is used to treat this condition."
25645505,Hydrocortisone treats Shock,41,[Anaphylaxis-like shock caused by hydrocortisone and prednisolone sodium succinate in an asthmatic patient].,False,Is the triple 'Hydrocortisone treats Shock' supported by the sentence: '[Anaphylaxis-like shock caused by hydrocortisone and prednisolone sodium succinate in an asthmatic patient].'?,"No, it is not directly supported because the given sentence discusses a case of anaphylactic shock caused by hydrocortisone and prednisolone sodium succinate, which suggests a possible adverse reaction to these medications, rather than their therapeutic effect in treating shock."
25268311,Hydrocortisone treats autoimmune disease,42,"In recent years, growing evidence has shown that 25-HC performs a critical function in the etiology of cancer, infectious diseases and autoimmune disorders.",False,"Is the triple 'Hydrocortisone treats autoimmune disease' supported by the sentence: 'In recent years, growing evidence has shown that 25-HC performs a critical function in the etiology of cancer, infectious diseases and autoimmune disorders.'?","No, it is not directly supported because hydrocortisone is mentioned in the statement, not 25-HC which is a metabolite of cholesterol and not a form of hydrocortisone. However, it is indirectly related because both hydrocortisone and 25-HC have roles in autoimmune disorders."
18446972,Hydrocortisone treats congenital adrenal hyperplasia,43,Congenital adrenal hyperplasia (CAH) is a chronic condition and individuals are exposed to elevated androgen levels in utero as a result of the endogenous cortisol deficiency.,True,Is the triple 'Hydrocortisone treats congenital adrenal hyperplasia' supported by the sentence: 'Congenital adrenal hyperplasia (CAH) is a chronic condition and individuals are exposed to elevated androgen levels in utero as a result of the endogenous cortisol deficiency.'?,"Yes, it is indirectly supported. The statement that individuals with CAH have elevated androgen levels in utero due to endogenous cortisol deficiency suggests that treating this cortisol deficiency, as Hydrocortisone does, could help manage the condition. However, it doesn't explicitly state that Hydrocortisone is used to treat CAH, hence it's an indirect support."
16762875,Hydrocortisone treats congestive heart failure,44,"In multivariate regression analysis, cortisol was an independent predictor of Vo2peak (R2 = 0.365, F = 12.5, SE = 3.4; p<=0.001) and Ve/Vco2 slope (R2 = 0.154; F = 8.5; SE = 5.96; p = 0.006), after accounting for age, body mass index, sex, CHF etiology, creatinine, left ventricular ejection fraction, and ACTH in all patients.",False,"Is the triple 'Hydrocortisone treats congestive heart failure' supported by the sentence: 'In multivariate regression analysis, cortisol was an independent predictor of Vo2peak (R2 = 0.365, F = 12.5, SE = 3.4; p<=0.001) and Ve/Vco2 slope (R2 = 0.154; F = 8.5; SE = 5.96; p = 0.006), after accounting for age, body mass index, sex, CHF etiology, creatinine, left ventricular ejection fraction, and ACTH in all patients.'?","No, this statement does not provide direct support for the claim that Hydrocortisone treats congestive heart failure (CHF). The statement is about a statistical correlation between cortisol levels (a hormone that Hydrocortisone can affect) and certain physiological measures (Vo2peak and Ve/Vco2 slope) in patients with CHF. It does not claim that Hydrocortisone is a treatment for CHF."
16290606,Hydrocortisone treats diabetes mellitus,45,"Increased cortisol results in diabetes, hence quelling the activity of 11betaHSD1 has been thought of as an effective approach for the treatment of diabetes.",True,"Is the triple 'Hydrocortisone treats diabetes mellitus' supported by the sentence: 'Increased cortisol results in diabetes, hence quelling the activity of 11betaHSD1 has been thought of as an effective approach for the treatment of diabetes.'?","Yes, it is indirectly supported. The statement suggests that increased levels of cortisol, which is produced by an enzyme called 11beta-hydroxysteroid dehydrogenase type 1 (11betaHSD1), can lead to diabetes. Therefore, inhibiting the activity of 11betaHSD1 could potentially help in treating diabetes. Hydrocortisone is a synthetic form of cortisol, so reducing its use could help manage diabetes by reducing cortisol levels. However, this is a complex physiological process with many factors, so it's important to consult with healthcare professionals for medical advice."
15562961,Hydrocortisone treats skin atrophy,46,"Long-term application of topical HC induced skin atrophy, measured by a reduction in skinfold and epidermal thickness and in the number of epidermal proliferating cell nucleus antigen (PCNA)-positive keratinocytes.",True,"Is the triple 'Hydrocortisone treats skin atrophy' supported by the sentence: 'Long-term application of topical HC induced skin atrophy, measured by a reduction in skinfold and epidermal thickness and in the number of epidermal proliferating cell nucleus antigen (PCNA)-positive keratinocytes.'?","Yes, it is indirectly supported. The given sentence suggests that long-term use of hydrocortisone (HC) can lead to a reduction in skinfold thickness, epidermal thickness, and the number of proliferating cell nucleus antigen (PCNA)-positive keratinocytes, which are all indicators of skin atrophy. Therefore, it supports the statement that hydrocortisone treats skin atrophy, as it can help manage the symptoms, but it's important to note that it can also cause it with long-term use."
15127550,Hydrocortisone treats synovitis,47,"RESULTS: Following induction of synovitis, ground reaction forces were significantly decreased relative to preinduction values at 2.5, 5.0, 7.5, and 10.0 hours and serum cortisol concentration was significantly increased at 2.5 hours.",True,"Is the triple 'Hydrocortisone treats synovitis' supported by the sentence: 'RESULTS: Following induction of synovitis, ground reaction forces were significantly decreased relative to preinduction values at 2.5, 5.0, 7.5, and 10.0 hours and serum cortisol concentration was significantly increased at 2.5 hours.'?","Yes, it is indirectly supported. The increased serum cortisol concentration at 2.5 hours suggests that hydrocortisone (a type of corticosteroid) has been administered, which is a treatment for synovitis. The decrease in ground reaction forces indicates a reduction in inflammation, which is a result of successful treatment. However, the sentence does not explicitly state that hydrocortisone is used to treat synovitis in this context."
10942128,Hydrocortisone treats epilepsy,48,Hydrocortisone-induced convulsions.,False,Is the triple 'Hydrocortisone treats epilepsy' supported by the sentence: 'Hydrocortisone-induced convulsions.'?,"No, this statement does not support the claim that Hydrocortisone treats epilepsy, but rather suggests a potential side effect of Hydrocortisone, which is hydrocortisone-induced convulsions."
