Predicate ID,Triple,Sentence ID,Sentence,Is Correct,Question,Answer
11187716,Ibuprofen affects DDIT3,1031,"NSAIDs other than indomethacin (diclofenac, ibuprofen and celecoxib) also induced CHOP.",True,"Is the triple 'Ibuprofen affects DDIT3' supported by the sentence: 'NSAIDs other than indomethacin (diclofenac, ibuprofen and celecoxib) also induced CHOP.'?","Yes, it is indirectly supported because it mentions that ibuprofen, like diclofenac, can induce CHOP, which is a protein also known as DDIT3."
11150354,Ibuprofen affects SLC5A8,1032,SMCT was strongly inhibited by 1 mm probenecid or ibuprofen.,True,Is the triple 'Ibuprofen affects SLC5A8' supported by the sentence: 'SMCT was strongly inhibited by 1 mm probenecid or ibuprofen.'?,"Yes, this statement does provide indirect evidence that ibuprofen can affect SLC5A8 (also known as SMCT). The sentence states that ibuprofen can inhibit SMCT, which suggests that it has an effect on its function. However, it does not explicitly state that ibuprofen interacts with SLC5A8 in a direct manner, hence it's an indirect support."
11332191,Ibuprofen affects CYP2C9,1033,"As compared with individuals with no mutations, individuals with the common genotype CYP2C8*1/*3 plus CYP2C9*1/*2 (19% of the population) displayed decreased ibuprofen clearance (mean, 65% [95% CI, 42%-89%]; P <.001).",True,"Is the triple 'Ibuprofen affects CYP2C9' supported by the sentence: 'As compared with individuals with no mutations, individuals with the common genotype CYP2C8*1/*3 plus CYP2C9*1/*2 (19% of the population) displayed decreased ibuprofen clearance (mean, 65% [95% CI, 42%-89%]; P <.001).'?","Yes, this sentence does provide support for the statement that Ibuprofen affects CYP2C9, but it does so indirectly. It suggests that genetic variations in CYP2C8 and CYP2C9 can influence ibuprofen clearance, implying that ibuprofen is a substrate of these enzymes. However, it does not directly state that ibuprofen affects these enzymes."
18333090,Ivabradine coexists with MALAT1,1034,"BACKGROUND: Ivabradine is an inhibitor of mixed Na+-K+ current that could combine with HCN channels to reduce the transmembrane velocity of funny current (If), heart rate, and cardiac efficiency, and thus be used for the treatment of cardiovascular diseases such as chronic heart failure.",False,"Is the triple 'Ivabradine coexists with MALAT1' supported by the sentence: 'BACKGROUND: Ivabradine is an inhibitor of mixed Na+-K+ current that could combine with HCN channels to reduce the transmembrane velocity of funny current (If), heart rate, and cardiac efficiency, and thus be used for the treatment of cardiovascular diseases such as chronic heart failure.'?","No, it's not directly supported. The sentence mentions Ivabradine's interaction with HCN channels, but it does not mention anything about MALAT1, a long non-coding RNA molecule."
19114135,Ivabradine coexists with CYP3A4,1035,"However, more research must be undertaken in order to determine the role of variants in HCN4 and CYP3A4 genes in response to ivabradine.",False,"Is the triple 'Ivabradine coexists with CYP3A4' supported by the sentence: 'However, more research must be undertaken in order to determine the role of variants in HCN4 and CYP3A4 genes in response to ivabradine.'?","No, it is not directly or indirectly supported. The statement discusses the need for further research on the role of genetic variants in response to ivabradine but does not mention whether ivabradine coexists with CYP3A4."
19114134,Ivabradine coexists with HCN4,1036,"However, more research must be undertaken in order to determine the role of variants in HCN4 and CYP3A4 genes in response to ivabradine.",False,"Is the triple 'Ivabradine coexists with HCN4' supported by the sentence: 'However, more research must be undertaken in order to determine the role of variants in HCN4 and CYP3A4 genes in response to ivabradine.'?","No. The statement is discussing further research needed to determine the role of gene variants in response to ivabradine, not affirming a direct or indirect relationship between Ivabradine and HCN4 as suggested by your question."
16703799,Ivabradine physically interacts with HCN4,1037,Identification of the molecular site of ivabradine binding to HCN4 channels.,True,Is the triple 'Ivabradine physically interacts with HCN4' supported by the sentence: 'Identification of the molecular site of ivabradine binding to HCN4 channels.'?,"Yes, the triple quote statement you provided does support that Ivabradine physically interacts with HCN4, as it mentions the identification of a molecular binding site for Ivabradine on HCN4 channels, which suggests a direct interaction."
13572358,Ivabradine physically interacts with HCN1,1038,"CONCLUSION: We conclude that (1) I(f)-associated tachyarrhythmias-if they occur with HCN-based biological pacemakers-can be controlled with I(f)-inhibiting drugs such as IVB; (2) in vitro, IVB appears to have a greater steady state inhibiting effect on HCN1 and HCN212 isoforms than on HCN4; and (3) VT originating from the HCN212 injection site is suppressed more readily than sinus rhythm.",True,"Is the triple 'Ivabradine physically interacts with HCN1' supported by the sentence: 'CONCLUSION: We conclude that (1) I(f)-associated tachyarrhythmias-if they occur with HCN-based biological pacemakers-can be controlled with I(f)-inhibiting drugs such as IVB; (2) in vitro, IVB appears to have a greater steady state inhibiting effect on HCN1 and HCN212 isoforms than on HCN4; and (3) VT originating from the HCN212 injection site is suppressed more readily than sinus rhythm.'?","Yes, this statement does support a physical interaction between Ivabradine and HCN1, although it is not explicitly stated in this exact wording. The first point indicates Ivabradine's ability to control I(f)-associated tachyarrhythmias, which implies some form of interaction between Ivabradine and I(f) channels, which are carried by HCN1 isoforms among others. The second point further supports this interaction, stating Ivabradine has a greater steady state inhibiting effect on HCN1 isoforms compared to HCN4, indicating a direct interaction between Ivabradine and HCN1 channels in vitro. Lastly, point three suggests Ivabradine can suppress ventricular tachycardia originating from the HCN2/HCN12 injection site, further implying an interaction between Ivabradine and HCN1 channels in a physiological context."
18841904,Ivabradine physically interacts with CYP3A4,1039,"Ivabradine is extensively metabolized by cytochrome P450 3A4, and its metabolism is affected by inducers and inhibitors of the 3A4 enzyme.",True,"Is the triple 'Ivabradine physically interacts with CYP3A4' supported by the sentence: 'Ivabradine is extensively metabolized by cytochrome P450 3A4, and its metabolism is affected by inducers and inhibitors of the 3A4 enzyme.'?","Yes, the statement does support the interaction between Ivabradine and CYP3A4, as it mentions Ivabradine as being metabolized by cytochrome P450 3A4 (CYP3A4). The interaction can be considered direct, as Ivabradine itself is a substrate of the enzyme, but it can also be considered an indirect interaction, as other substances can influence this metabolism through induction or inhibition of the 3A4 enzyme."
16703802,Ivabradine physically interacts with HCN4,1040,"We thus sought to investigate by mutagenesis and in silico analysis which residues of the HCN4 channel, the HCN isoform expressed in the sinoatrial node, are involved in the binding of ivabradine.",True,"Is the triple 'Ivabradine physically interacts with HCN4' supported by the sentence: 'We thus sought to investigate by mutagenesis and in silico analysis which residues of the HCN4 channel, the HCN isoform expressed in the sinoatrial node, are involved in the binding of ivabradine.'?","Yes, this statement does support that ivabradine has a physical interaction with HCN4, as it mentions an investigation into which residues of the HCN4 channel bind with ivabradine through both experimental (mutagenesis) and computational (in silico analysis) methods."
16703801,Ivabradine physically interacts with MALAT1,1041,"Different studies suggest that the binding site of ivabradine is located in the inner vestibule of HCN channels, but the molecular details of ivabradine binding are unknown.",False,"Is the triple 'Ivabradine physically interacts with MALAT1' supported by the sentence: 'Different studies suggest that the binding site of ivabradine is located in the inner vestibule of HCN channels, but the molecular details of ivabradine binding are unknown.'?","No, this statement does not provide direct or indirect evidence for a physical interaction between Ivabradine and MALAT1. The statement discusses the binding site of Ivabradine in HCN channels, not in relation to MALAT1."
18292427,Ivabradine affects MALAT1,1042,"BACKGROUND: Ivabradine is a specific bradycardic agent used in coronary artery disease and heart failure, lowering heart rate through inhibition of sinoatrial nodal HCN-channels.",False,"Is the triple 'Ivabradine affects MALAT1' supported by the sentence: 'BACKGROUND: Ivabradine is a specific bradycardic agent used in coronary artery disease and heart failure, lowering heart rate through inhibition of sinoatrial nodal HCN-channels.'?","No, that sentence does not provide direct or indirect support for the statement that ivabradine affects MALAT1. It mentions ivabradine's effects on heart rate through inhibition of sinoatrial nodal HCN-channels, but it does not mention anything about MALAT1."
12313073,Ivabradine affects HCN4,1043,"In summary our results indicate that ivabradine is an 'open-channel' blocker of hHCN4, and a 'closed-channel' blocker of mHCN1 channels.",True,"Is the triple 'Ivabradine affects HCN4' supported by the sentence: 'In summary our results indicate that ivabradine is an 'open-channel' blocker of hHCN4, and a 'closed-channel' blocker of mHCN1 channels.'?","Yes, the statement does support the claim that Ivabradine affects HCN4, as it mentions Ivabradine as an 'open-channel' blocker of hHCN4 channels, implying a direct interaction between Ivabradine and hHCN4 channels."
19114132,Ivabradine affects CYP3A4,1044,Analysis of variants in the HCN4 gene and in three single nucleotide polymorphisms of the CYP3A4 gene for association with ivabradine reduction in heart rate: A preliminary report.,False,Is the triple 'Ivabradine affects CYP3A4' supported by the sentence: 'Analysis of variants in the HCN4 gene and in three single nucleotide polymorphisms of the CYP3A4 gene for association with ivabradine reduction in heart rate: A preliminary report.'?,"No, it is not directly or indirectly supported because this study does not examine the effect of ivabradine on CYP3A4, but rather analyzes genetic variations related to ivabradine response."
17255834,Ranolazine coexists with SCN5A,1045,"Sodium channel blockers such as mexiletine, flecainide, and ranolazine could be treatment options in LQT3.",True,"Is the triple 'Ranolazine coexists with SCN5A' supported by the sentence: 'Sodium channel blockers such as mexiletine, flecainide, and ranolazine could be treatment options in LQT3.'?","Yes, it is indirectly supported because it mentions that ranolazine, a sodium channel blocker, is a treatment option for LQT3, which implies that it can coexist with a mutation in the SCN5A gene, which is associated with LQT3."
17255834,Ranolazine coexists with SCN5A,1046,"Sodium channel blockers such as mexiletine, flecainide, and ranolazine could be treatment options in LQT3.",True,"Is the triple 'Ranolazine coexists with SCN5A' supported by the sentence: 'Sodium channel blockers such as mexiletine, flecainide, and ranolazine could be treatment options in LQT3.'?","Yes, it is indirectly supported. The mention of ranolazine as a sodium channel blocker in a potential treatment option for LQT3 suggests that ranolazine has an effect on the SCN5A gene, which is associated with LQT3."
19262445,Ranolazine physically interacts with SCN5A,1047,"We, therefore, evaluated the effects of ranolazine in LQT3 caused by the D1790G mutation in SCN5A.",True,"Is the triple 'Ranolazine physically interacts with SCN5A' supported by the sentence: 'We, therefore, evaluated the effects of ranolazine in LQT3 caused by the D1790G mutation in SCN5A.'?","Yes, the triple statement ""Ranolazine physically interacts with SCN5A"" is indirectly supported by the provided sentence. This is because the sentence suggests that ranolazine has an effect on a specific mutation (D1790G) in the SCN5A gene, implying some form of interaction between them. However, it's important to note that this doesn't necessarily mean a direct physical interaction; it could also refer to a biochemical interaction, for example. For a definitive conclusion about the nature of this interaction, further information would be required."
19262445,Ranolazine physically interacts with SCN5A,1048,"We, therefore, evaluated the effects of ranolazine in LQT3 caused by the D1790G mutation in SCN5A.",True,"Is the triple 'Ranolazine physically interacts with SCN5A' supported by the sentence: 'We, therefore, evaluated the effects of ranolazine in LQT3 caused by the D1790G mutation in SCN5A.'?","Yes, the triple quote statement does provide support for a physical interaction between Ranolazine and SCN5A in the context of LQT3 caused by the D1790G mutation in SCN5A. The use of the term 'effects' implies a direct or indirect interaction between Ranolazine and the specified mutation in SCN5A."
23471283,Ranolazine physically interacts with SCN5A,1049,"Here, we investigated the impact of accessory NaVbeta1 and NaVbeta3 subunits on the functional effects of two well-known Class-Ib antiarrhythmics, lidocaine and ranolazine, on the predominant NaV channel alpha subunit, Nav1.5, expressed in mammalian heart.",True,"Is the triple 'Ranolazine physically interacts with SCN5A' supported by the sentence: 'Here, we investigated the impact of accessory NaVbeta1 and NaVbeta3 subunits on the functional effects of two well-known Class-Ib antiarrhythmics, lidocaine and ranolazine, on the predominant NaV channel alpha subunit, Nav1.5, expressed in mammalian heart.'?","Yes, the statement does support that Ranolazine has some form of interaction with SCN5A (Nav1.5), as it is being studied in conjunction with this protein in the provided context. However, it does not explicitly state whether this interaction is direct or indirect."
23471283,Ranolazine physically interacts with SCN5A,1050,"Here, we investigated the impact of accessory NaVbeta1 and NaVbeta3 subunits on the functional effects of two well-known Class-Ib antiarrhythmics, lidocaine and ranolazine, on the predominant NaV channel alpha subunit, Nav1.5, expressed in mammalian heart.",True,"Is the triple 'Ranolazine physically interacts with SCN5A' supported by the sentence: 'Here, we investigated the impact of accessory NaVbeta1 and NaVbeta3 subunits on the functional effects of two well-known Class-Ib antiarrhythmics, lidocaine and ranolazine, on the predominant NaV channel alpha subunit, Nav1.5, expressed in mammalian heart.'?","Yes, the statement does provide some support for a physical interaction between Ranolazine and SCN5A (Nav1.5). The investigation into the functional effects of Ranolazine on Nav1.5 implies a direct interaction between the two molecules. However, it does not explicitly confirm a physical interaction between Ranolazine and the specific subunits NaVbeta1 and NaVbeta3 mentioned in the study."
27603501,Albendazole treats aplastic anemia,2,[Aplastic anemia induced by albendazole].,False,Is the triple 'Albendazole treats aplastic anemia' supported by the sentence: '[Aplastic anemia induced by albendazole].'?,"No, it is not directly nor indirectly supported, as the given sentence suggests that albendazole can induce, rather than treat, aplastic anemia."
11722744,Albendazole treats pancytopenia,3,The severity and duration of albendazole-induced pancytopenia in this case was likely related to the underlying liver disease.,False,Is the triple 'Albendazole treats pancytopenia' supported by the sentence: 'The severity and duration of albendazole-induced pancytopenia in this case was likely related to the underlying liver disease.'?,"No, it is not directly supported because it suggests that Albendazole can cause pancytopenia, but in this case, it might be worsened due to underlying liver disease, implying a possible indirect relationship between Albendazole treating pancytopenia and the given statement."
26856641,Ibuprofen treats thrombocytopenia,4,Described below is a case of life-threatening thrombocytopenia induced by ibuprofen.,True,Is the triple 'Ibuprofen treats thrombocytopenia' supported by the sentence: 'Described below is a case of life-threatening thrombocytopenia induced by ibuprofen.'?,"Yes, it is indirectly supported. The provided sentence suggests that ibuprofen can induce thrombocytopenia, which implies that ibuprofen does not treat but rather can cause this condition."
26672586,Ibuprofen treats Shock,5,"Using a suboptimal dose of LPS (10 mg/kg i.p.), pretreatment with indomethacin (0.1-10 mg/kg p.o) or ibuprofen (1-100 mg/kg p.o) 30 min prior to induction of shock led to a significant enhancement of mortality.",True,"Is the triple 'Ibuprofen treats Shock' supported by the sentence: 'Using a suboptimal dose of LPS (10 mg/kg i.p.), pretreatment with indomethacin (0.1-10 mg/kg p.o) or ibuprofen (1-100 mg/kg p.o) 30 min prior to induction of shock led to a significant enhancement of mortality.'?","Yes, it is indirectly supported. The given sentence suggests that pretreatment with ibuprofen increases mortality in shock, which implies that ibuprofen does not treat shock but may exacerbate it when used in certain doses."
18620135,Ibuprofen treats Thromboembolism,6,High-dose ibuprofen is likely to have accounted for the life-threatening thromboembolic disorder.,True,Is the triple 'Ibuprofen treats Thromboembolism' supported by the sentence: 'High-dose ibuprofen is likely to have accounted for the life-threatening thromboembolic disorder.'?,"Yes, it is indirectly supported. The original statement suggests that high-dose ibuprofen may have contributed to a life-threatening thromboembolic disorder, implying that ibuprofen has an effect on thromboembolism, which aligns with the statement that 'ibuprofen treats thromboembolism' in a therapeutic or preventive context, albeit in a negative way in this instance. However, it's important to note that this does not mean that ibuprofen is recommended for treating thromboembolism, as high doses can lead to complications."
13726345,Ibuprofen treats patent ductus arteriosus,7,"CONCLUSIONS: Ibuprofen-induced patent ductus arteriosus closure improved pulmonary mechanics, decreased total lung water, increased epithelial sodium channel expression, and decreased the detrimental effects of preterm birth on alveolarization.",Undefined,"Is the triple 'Ibuprofen treats patent ductus arteriosus' supported by the sentence: 'CONCLUSIONS: Ibuprofen-induced patent ductus arteriosus closure improved pulmonary mechanics, decreased total lung water, increased epithelial sodium channel expression, and decreased the detrimental effects of preterm birth on alveolarization.'?","The statement does offer support for ibuprofen's role in treating patent ductus arteriosus (PDA), but it does so indirectly. The conclusion you've provided suggests that ibuprofen use leads to PDA closure, which in turn improves pulmonary mechanics, decreases total lung water, increases epithelial sodium channel expression, and mitigates negative effects on alveolarization. However, it doesn't explicitly state that ibuprofen treats PDA, but rather implies it through its effects on PDA closure and related outcomes. So, my answer would be 'no' if you're asking about direct support, but 'yes' if you're considering indirect support."
13658150,Ibuprofen treats cardiac rhythm disease,8,"RESULTS: The ECG recording revealed that ibuprofen could induce arrhythmias, both in vitro and in vivo.",False,"Is the triple 'Ibuprofen treats cardiac rhythm disease' supported by the sentence: 'RESULTS: The ECG recording revealed that ibuprofen could induce arrhythmias, both in vitro and in vivo.'?","No, it is not directly or indirectly supported. In fact, the results suggest a potential for arrhythmias, which is contrary to treating a cardiac rhythm disease."
13133316,Ibuprofen treats peptic ulcer disease,9,Protective effect of glucosamine against ibuprofen-induced peptic ulcer in rats.,False,Is the triple 'Ibuprofen treats peptic ulcer disease' supported by the sentence: 'Protective effect of glucosamine against ibuprofen-induced peptic ulcer in rats.'?,"No, it is not directly supported because this study was conducted in rats, not humans, and it does not explicitly state that ibuprofen is used to treat peptic ulcers in this context, but rather it investigates ibuprofen-induced peptic ulcers in rats, which could potentially imply a preventative role for glucosamine in counteracting this side-effect in rats, not a treatment role for ibuprofen in treating peptic ulcers in humans."
12641386,Ibuprofen treats Fever,10,Ibuprofen-induced fever in Sjogren's syndrome.,False,Is the triple 'Ibuprofen treats Fever' supported by the sentence: 'Ibuprofen-induced fever in Sjogren's syndrome.'?,"No, it is not directly supported because the given sentence discusses ibuprofen inducing fever in a specific condition (Sjogren's syndrome), whereas the statement you provided asserts that ibuprofen treats fever. However, it doesn't rule out the possibility that ibuprofen could treat fever under different circumstances, just not those described in the given sentence."
11574148,Ibuprofen treats potassium deficiency disease,11,"Ibuprofen is generally not included in a standard toxicology screen, but should be considered as a rare cause of hypokalaemia.",False,"Is the triple 'Ibuprofen treats potassium deficiency disease' supported by the sentence: 'Ibuprofen is generally not included in a standard toxicology screen, but should be considered as a rare cause of hypokalaemia.'?","No, it is not directly nor indirectly supported, as hypokalaemia (low potassium levels) is a potential side effect of Ibuprofen, but it does not imply that Ibuprofen can be used to treat a potassium deficiency disease."
11172255,Ibuprofen treats active peptic ulcer disease,12,"Data on individual drugs are inconsistent, but they suggest that enteric-coated aspirin, salsalate, and ibuprofen cause the lowest incidence of GI hemorrhage.",True,"Is the triple 'Ibuprofen treats active peptic ulcer disease' supported by the sentence: 'Data on individual drugs are inconsistent, but they suggest that enteric-coated aspirin, salsalate, and ibuprofen cause the lowest incidence of GI hemorrhage.'?","Yes, it is indirectly supported. The sentence suggests that among nonsteroidal anti-inflammatory drugs (NSAIDs), enteric-coated aspirin, salsalate, and ibuprofen have a lower incidence of gastrointestinal (GI) hemorrhage. This implies that these NSAIDs may be safer for the stomach than others, which could potentially include treatment for active peptic ulcer disease. However, it's important to note that this is an indirect inference and not a direct claim from the provided sentence."
11157616,Ibuprofen treats Pain,13,"In a double-blind cross-over study on 22 healthy subjects the analgesic efficacies of the antipyretic analgesic drugs ibuprofen, dipyrone and paracetamol were tested against placebo using a model of experimentally induced pain.",Undefined,"Is the triple 'Ibuprofen treats Pain' supported by the sentence: 'In a double-blind cross-over study on 22 healthy subjects the analgesic efficacies of the antipyretic analgesic drugs ibuprofen, dipyrone and paracetamol were tested against placebo using a model of experimentally induced pain.'?","The statement is indirectly supportive of the claim that Ibuprofen treats pain, as it suggests that Ibuprofen was tested for its analgesic (pain relief) efficacy in a scientific study, which implies that it has some effect in treating pain, even though it doesn't directly state that Ibuprofen was found to be effective in treating pain in this particular study."
10060263,Ibuprofen treats Coma,14,Hyponatraemic coma induced by desmopressin and ibuprofen in a woman with von Willebrand's disease.,True,Is the triple 'Ibuprofen treats Coma' supported by the sentence: 'Hyponatraemic coma induced by desmopressin and ibuprofen in a woman with von Willebrand's disease.'?,"Yes, it is indirectly supported. The given sentence suggests that ibuprofen, in combination with desmopressin, can induce a hyponatraemic coma in a specific medical condition (von Willebrand's disease). This implies that ibuprofen has an effect on the state of consciousness, even though it doesn't necessarily mean that ibuprofen is used as a treatment for coma."
9983282,Ibuprofen treats Edema,15,"The aryl sulfonyl methyl thiophene analogs AP29, AP82, and AP37, when screened for anti-inflammatory activity in carrageenin induced rat paw edema, an acute in vivo model, exhibited moderate to good activity at a dose level of 100 mg/kg body weight P.o compared to Ibuprofen.",Undefined,"Is the triple 'Ibuprofen treats Edema' supported by the sentence: 'The aryl sulfonyl methyl thiophene analogs AP29, AP82, and AP37, when screened for anti-inflammatory activity in carrageenin induced rat paw edema, an acute in vivo model, exhibited moderate to good activity at a dose level of 100 mg/kg body weight P.o compared to Ibuprofen.'?","Indirectly, because it mentions Ibuprofen's anti-inflammatory activity in a specific model of edema, implying that Ibuprofen can treat edema, but it doesn't explicitly state that Ibuprofen treats edema in general."
