Predicate ID,Triple,Sentence ID,Sentence,Is Correct,Question,Answer
9675722,Fenbendazole affects CYP1A2,1001,Fenbendazole (FBZ) is an anthelmintic drug known to be a potent CYP1A2 inducer.,True,Is the triple 'Fenbendazole affects CYP1A2' supported by the sentence: 'Fenbendazole (FBZ) is an anthelmintic drug known to be a potent CYP1A2 inducer.'?,"Yes, the statement ""Fenbendazole (FBZ) is an anthelmintic drug known to be a potent CYP1A2 inducer."" does support the claim that Fenbendazole affects CYP1A2, as it indicates that Fenbendazole can induce CYP1A2, which implies a direct interaction between Fenbendazole and the CYP1A2 enzyme system."
14281126,Thiabendazole affects CYP1A2,1002,IC(50) shift studies also demonstrated that TBZ was a TDI of CYP1A2.,True,Is the triple 'Thiabendazole affects CYP1A2' supported by the sentence: 'IC(50) shift studies also demonstrated that TBZ was a TDI of CYP1A2.'?,"Yes, the triple statement ""Thiabendazole affects CYP1A2"" is directly supported by the given sentence. The sentence states that Thiabendazole (TBZ) is a time-dependent inhibitor (TDI) of CYP1A2, which means it affects the function of CYP1A2 enzyme over time, thus supporting the claim that Thiabendazole interacts with CYP1A2 in some capacity."
17103147,Albendazole coexists with CYP2J2,1003,Correlation analysis between the known P450 enzyme activities and the rate of hydroxyalbendazole and hydroxyfenbendazole formation in samples from 14 human liver microsomes showed that albendazole hydroxylation correlates with CYP2J2 activity and fenbendazole hydroxylation correlates with CYP2C19 and CYP2J2 activities.,True,Is the triple 'Albendazole coexists with CYP2J2' supported by the sentence: 'Correlation analysis between the known P450 enzyme activities and the rate of hydroxyalbendazole and hydroxyfenbendazole formation in samples from 14 human liver microsomes showed that albendazole hydroxylation correlates with CYP2J2 activity and fenbendazole hydroxylation correlates with CYP2C19 and CYP2J2 activities.'?,"Yes, it is indirectly supported. The correlation between albendazole hydroxylation and CYP2J2 activity suggests that Albendazole may interact with CYP2J2, but it does not directly state that they coexist."
17103146,Albendazole physically interacts with CYP2J2,1004,"Albendazole hydroxylation to hydroxyalbendazole is primarily mediated by CYP2J2 (0.34 MUl/min/pmol P450, which is a rate 3.9- and 8.1-fold higher than the rates for CYP2C19 and CYP2E1, respectively), whereas CYP2C19 and CYP2J2 contributed to the formation of hydroxyfenbendazole from fenbendazole (2.68 and 1.94 MUl/min/pmol P450 for CYP2C19 and CYP2J2, respectively, which are rates 11.7- and 8.4-fold higher than the rate for CYP2D6).",True,"Is the triple 'Albendazole physically interacts with CYP2J2' supported by the sentence: 'Albendazole hydroxylation to hydroxyalbendazole is primarily mediated by CYP2J2 (0.34 MUl/min/pmol P450, which is a rate 3.9- and 8.1-fold higher than the rates for CYP2C19 and CYP2E1, respectively), whereas CYP2C19 and CYP2J2 contributed to the formation of hydroxyfenbendazole from fenbendazole (2.68 and 1.94 MUl/min/pmol P450 for CYP2C19 and CYP2J2, respectively, which are rates 11.7- and 8.4-fold higher than the rate for CYP2D6).'?","Yes, the statement does support that Albendazole has a physical interaction with CYP2J2, as it mentions that Albendazole is primarily metabolized by CYP2J2. However, it's important to note that this interaction is in the context of a metabolic pathway, not a direct physical interaction as might be considered in a biophysical or chemical context."
9898324,Albendazole affects CYP1A2,1005,"CONCLUSIONS: Quinine, albendazole and primaquine induce CYP1A1 and CYP1A2 at the transcriptional level.",True,"Is the triple 'Albendazole affects CYP1A2' supported by the sentence: 'CONCLUSIONS: Quinine, albendazole and primaquine induce CYP1A1 and CYP1A2 at the transcriptional level.'?","Yes, it is indirectly supported because Albendazole is mentioned as inducing CYP1A2 at the transcriptional level in the given sentence."
13904814,Ibuprofen related to CYP2C9,1006,"CYP2C9*3 allele had a decreased racemic ibuprofen metabolism, leading to a 30% augmentation of AUC(0-infinity) and a 30% reduction of clearance compared to CYP2C9*1 (p < 0.05).",True,"Is the triple 'Ibuprofen related to CYP2C9' supported by the sentence: 'CYP2C9*3 allele had a decreased racemic ibuprofen metabolism, leading to a 30% augmentation of AUC(0-infinity) and a 30% reduction of clearance compared to CYP2C9*1 (p < 0.05).'?","Yes, this statement does support a relationship between Ibuprofen and CYP2C9, as it mentions that a specific allele of CYP2C9 (CYP2C9*3) affects the metabolism of Ibuprofen, leading to changes in its pharmacokinetic parameters (AUC(0-infinity) and clearance)."
12021816,Ibuprofen coexists with PTGS2,1007,"Also in view of its therapeutic use, its wide therapeutic index and uncomplicated pharmacokinetic properties, a biowaiver for immediate release (IR) ibuprofen solid oral drug products is scientifically justified, provided that the test product contains only those excipients reported in this paper in their usual amounts, the dosage form is rapidly dissolving (85% in 30 min or less) in buffer pH 6.8 and the test product also exhibits similar dissolution profiles to the reference product in buffer pH 1.2, 4.5, and 6.8.",False,"Is the triple 'Ibuprofen coexists with PTGS2' supported by the sentence: 'Also in view of its therapeutic use, its wide therapeutic index and uncomplicated pharmacokinetic properties, a biowaiver for immediate release (IR) ibuprofen solid oral drug products is scientifically justified, provided that the test product contains only those excipients reported in this paper in their usual amounts, the dosage form is rapidly dissolving (85% in 30 min or less) in buffer pH 6.8 and the test product also exhibits similar dissolution profiles to the reference product in buffer pH 1.2, 4.5, and 6.8.'?","No, this statement does not provide direct or indirect support for the triple claim that ibuprofen coexists with PTGS2 (Prostaglandin-Endoperoxide Synthase 2). This statement is about the biowaiver for immediate release ibuprofen solid oral drug products, their therapeutic index, pharmacokinetic properties, excipients, dissolution profiles, and pH compatibility, but it does not mention nor imply any relationship between ibuprofen and PTGS2."
12021816,Ibuprofen coexists with PTGS2,1008,"Also in view of its therapeutic use, its wide therapeutic index and uncomplicated pharmacokinetic properties, a biowaiver for immediate release (IR) ibuprofen solid oral drug products is scientifically justified, provided that the test product contains only those excipients reported in this paper in their usual amounts, the dosage form is rapidly dissolving (85% in 30 min or less) in buffer pH 6.8 and the test product also exhibits similar dissolution profiles to the reference product in buffer pH 1.2, 4.5, and 6.8.",False,"Is the triple 'Ibuprofen coexists with PTGS2' supported by the sentence: 'Also in view of its therapeutic use, its wide therapeutic index and uncomplicated pharmacokinetic properties, a biowaiver for immediate release (IR) ibuprofen solid oral drug products is scientifically justified, provided that the test product contains only those excipients reported in this paper in their usual amounts, the dosage form is rapidly dissolving (85% in 30 min or less) in buffer pH 6.8 and the test product also exhibits similar dissolution profiles to the reference product in buffer pH 1.2, 4.5, and 6.8.'?","No, this statement does not provide direct or indirect support for the triple statement ""Ibuprofen coexists with PTGS2"". This statement is discussing the scientific justification for a biowaiver for immediate release ibuprofen solid oral drug products, based on certain conditions such as excipients, dissolution rates, and dissolution profiles."
11332192,Ibuprofen coexists with CYP2C8,1009,"CONCLUSION: Low ibuprofen clearance occurs in a substantial proportion of healthy subjects, is not enantiospecific, and is strongly linked to CYP2C8 and CYP2C9 polymorphisms.",True,"Is the triple 'Ibuprofen coexists with CYP2C8' supported by the sentence: 'CONCLUSION: Low ibuprofen clearance occurs in a substantial proportion of healthy subjects, is not enantiospecific, and is strongly linked to CYP2C8 and CYP2C9 polymorphisms.'?","Yes, the triple statement is indirectly supported by this sentence, as it mentions that low ibuprofen clearance is strongly linked to both CYP2C8 and CYP2C9 polymorphisms, indicating a relationship between ibuprofen and CYP2C8, even though it does not explicitly state that they 'coexist'."
11267890,Ibuprofen coexists with VHL,1010,Ibuprofen inhibited HIFs in VHL+ve cells expressing basal levels of HIFs.,True,Is the triple 'Ibuprofen coexists with VHL' supported by the sentence: 'Ibuprofen inhibited HIFs in VHL+ve cells expressing basal levels of HIFs.'?,"Yes, it is indirectly supported. The statement suggests that Ibuprofen can inhibit HIFs (Hypoxia Inducible Factors) in cells that have VHL (Von Hippel-Lindau) and express basal levels of HIFs. This implies that Ibuprofen can have an effect on cells where VHL is present, which could be interpreted as a form of coexistence. However, it does not directly state that Ibuprofen coexists with VHL, but rather that it interacts with cells that contain both."
9685478,Ibuprofen coexists with CYP2C9,1011,METHODS: Kinetics of an oral dose of 600 mg racemic ibuprofen were studied in 21 healthy volunteers with all combinations of the CYP2C9 variants *2 (arginine144cysteine) and *3 (isoleucine359leucine).,False,Is the triple 'Ibuprofen coexists with CYP2C9' supported by the sentence: 'METHODS: Kinetics of an oral dose of 600 mg racemic ibuprofen were studied in 21 healthy volunteers with all combinations of the CYP2C9 variants *2 (arginine144cysteine) and *3 (isoleucine359leucine).'?,"No, the given statement does not provide direct evidence for the coexistence of Ibuprofen and CYP2C9, nor does it provide any information about their relationship, whether direct or indirect. It merely describes a study on the kinetics of Ibuprofen in volunteers with different combinations of CYP2C9 variants."
16843610,Ibuprofen physically interacts with CYP2C8,1012,"Influence of CYP2C8 polymorphisms on the hydroxylation metabolism of paclitaxel, repaglinide and ibuprofen enantiomers in vitro.",True,"Is the triple 'Ibuprofen physically interacts with CYP2C8' supported by the sentence: 'Influence of CYP2C8 polymorphisms on the hydroxylation metabolism of paclitaxel, repaglinide and ibuprofen enantiomers in vitro.'?","Yes, it is indirectly supported because it mentions Ibuprofen's interaction with CYP2C8, but it does not specify whether it's a direct interaction."
15821183,Ibuprofen physically interacts with UGT2B17,1013,"These observations are important in the development of vorinostat, and may have clinical implications on other cancer and noncancer drugs that are UGT2B17 substrates such as exemestane and ibuprofen.",True,"Is the triple 'Ibuprofen physically interacts with UGT2B17' supported by the sentence: 'These observations are important in the development of vorinostat, and may have clinical implications on other cancer and noncancer drugs that are UGT2B17 substrates such as exemestane and ibuprofen.'?","Yes, it is indirectly supported. The sentence mentions ibuprofen as a substrate of UGT2B17, implying a physical interaction, but it does not provide direct evidence of this interaction."
13723860,Ibuprofen physically interacts with SLC5A8,1014,"Non-steroidal anti-inflammatory drugs such as ibuprofen, ketoprofen, and fenoprofen, also interact with SLC5A8.",True,"Is the triple 'Ibuprofen physically interacts with SLC5A8' supported by the sentence: 'Non-steroidal anti-inflammatory drugs such as ibuprofen, ketoprofen, and fenoprofen, also interact with SLC5A8.'?","Yes, the statement does support the idea that ibuprofen physically interacts with SLC5A8, either directly or indirectly, as it is listed among other non-steroidal anti-inflammatory drugs that interact with SLC5A8. However, it does not specify whether this interaction is direct or indirect."
11122111,Ibuprofen physically interacts with CYP2C9,1015,"Other dental therapeutic agents are substrates for CYP2C9 (celecoxib, ibuprofen and naproxen), CYP2D6 (codeine and tramadol), CYP3A4 (methylprednisolone) and CYP2E1 (acetaminophen).",True,"Is the triple 'Ibuprofen physically interacts with CYP2C9' supported by the sentence: 'Other dental therapeutic agents are substrates for CYP2C9 (celecoxib, ibuprofen and naproxen), CYP2D6 (codeine and tramadol), CYP3A4 (methylprednisolone) and CYP2E1 (acetaminophen).'?","Yes, the triple quote statement is indirectly supported by the given sentence, as it mentions ibuprofen as a substrate for CYP2C9, indicating a physical interaction between them, although it does not explicitly state that ibuprofen physically interacts with CYP2C9 in this context."
18492042,Ibuprofen physically interacts with CYP2D6,1016,"The aim of the present study was to evaluate the effect of exposure to ethanol fuel on in vivo activities of cytochrome P450 (CYP) isoenzymes CYP3A, CYP2C and CYP2D by the oral administration of the probe drugs verapamil, ibuprofen and fluoxetine.",False,"Is the triple 'Ibuprofen physically interacts with CYP2D6' supported by the sentence: 'The aim of the present study was to evaluate the effect of exposure to ethanol fuel on in vivo activities of cytochrome P450 (CYP) isoenzymes CYP3A, CYP2C and CYP2D by the oral administration of the probe drugs verapamil, ibuprofen and fluoxetine.'?","No, it is not explicitly stated in this sentence that ibuprofen physically interacts with CYP2D6, either directly or indirectly. The sentence simply mentions that ibuprofen is used as a probe drug to evaluate the effect of exposure to ethanol fuel on in vivo activities of cytochrome P450 (CYP) isoenzymes, including CYP2D."
18492041,Ibuprofen physically interacts with CYP2C19,1017,"The aim of the present study was to evaluate the effect of exposure to ethanol fuel on in vivo activities of cytochrome P450 (CYP) isoenzymes CYP3A, CYP2C and CYP2D by the oral administration of the probe drugs verapamil, ibuprofen and fluoxetine.",False,"Is the triple 'Ibuprofen physically interacts with CYP2C19' supported by the sentence: 'The aim of the present study was to evaluate the effect of exposure to ethanol fuel on in vivo activities of cytochrome P450 (CYP) isoenzymes CYP3A, CYP2C and CYP2D by the oral administration of the probe drugs verapamil, ibuprofen and fluoxetine.'?","No, this statement does not provide direct evidence for physical interaction between Ibuprofen and CYP2C19, nor does it provide indirect evidence, as it simply mentions Ibuprofen as one of the probe drugs used to evaluate the effect of ethanol fuel on in vivo activities of cytochrome P450 (CYP) isoenzymes, without any reference to interaction with a specific isoenzyme like CYP2C19."
16221363,Ibuprofen physically interacts with CYP3A4,1018,"Among the five CYPs evaluated, CYP3A4 and 2D6 are the most active in the oxidation of phospho-ibuprofen and phospho-sulindac respectively.",False,"Is the triple 'Ibuprofen physically interacts with CYP3A4' supported by the sentence: 'Among the five CYPs evaluated, CYP3A4 and 2D6 are the most active in the oxidation of phospho-ibuprofen and phospho-sulindac respectively.'?","No, this statement does not provide direct evidence for a physical interaction between Ibuprofen and CYP3A4, nor does it indicate an indirect interaction between them. It merely states that Ibuprofen is oxidized by CYP3A4, which is a metabolic process rather than an interaction in a physical sense."
16221361,Ibuprofen physically interacts with CYP1A2,1019,"CYP1A2, 2C19, 2D6 and 3A4 oxidize phospho-ibuprofen, but not ibuprofen; whereas CYP2C9 oxidizes ibuprofen, but not phospho-ibuprofen.",True,"Is the triple 'Ibuprofen physically interacts with CYP1A2' supported by the sentence: 'CYP1A2, 2C19, 2D6 and 3A4 oxidize phospho-ibuprofen, but not ibuprofen; whereas CYP2C9 oxidizes ibuprofen, but not phospho-ibuprofen.'?","Yes. The statement implies that ibuprofen is metabolized differently than phospho-ibuprofen, suggesting a physical interaction between ibuprofen and certain cytochrome P450 enzymes (CYP1A2, 2C19, 2D6, and 3A4). However, it does not specify whether these enzymes interact directly with ibuprofen or if the interaction is mediated through other molecules (indirect interaction). Therefore, while the statement supports a physical interaction, it does not explicitly confirm direct interaction between ibuprofen and CYP1A2."
11332190,Ibuprofen physically interacts with CYP2C8,1020,"The main genetic factor for reduced clearance of R-(-)-ibuprofen is the CYP2C8*3 allele, whereas the clearance for S-(+)-ibuprofen is influenced by CYP2C8*3 and CYP2C9*3 alleles to a similar extent.",True,"Is the triple 'Ibuprofen physically interacts with CYP2C8' supported by the sentence: 'The main genetic factor for reduced clearance of R-(-)-ibuprofen is the CYP2C8*3 allele, whereas the clearance for S-(+)-ibuprofen is influenced by CYP2C8*3 and CYP2C9*3 alleles to a similar extent.'?","Yes, it is indirectly supported. The statement suggests that certain alleles of the CYP2C8 gene affect the clearance of R-(-)-ibuprofen and S-(+)-ibuprofen, implying a physical interaction between ibuprofen and CYP2C8, albeit indirectly through these alleles."
11122119,Ibuprofen physically interacts with CYP2C9,1021,"Other dental therapeutic agents are substrates for CYP2C9 (celecoxib, ibuprofen and naproxen), CYP2D6 (codeine and tramadol), CYP3A4 (methylprednisolone) and CYP2E1 (acetaminophen).",True,"Is the triple 'Ibuprofen physically interacts with CYP2C9' supported by the sentence: 'Other dental therapeutic agents are substrates for CYP2C9 (celecoxib, ibuprofen and naproxen), CYP2D6 (codeine and tramadol), CYP3A4 (methylprednisolone) and CYP2E1 (acetaminophen).'?","Yes, the statement supports that Ibuprofen physically interacts with CYP2C9 because it lists Ibuprofen as a substrate for CYP2C9, indicating a direct interaction between them."
27669973,Ibuprofen affects CYP2C9,1022,"When residues 228-282 (containing SRS 3) of CYP2C9 were replaced by those of CYP2C19, the chimera retained appreciable activity for diclofenac and ibuprofen, and tolbutamide activity was inhibited by a specific CYP2C9 inhibitor, sulfaphenazole.",True,"Is the triple 'Ibuprofen affects CYP2C9' supported by the sentence: 'When residues 228-282 (containing SRS 3) of CYP2C9 were replaced by those of CYP2C19, the chimera retained appreciable activity for diclofenac and ibuprofen, and tolbutamide activity was inhibited by a specific CYP2C9 inhibitor, sulfaphenazole.'?","Yes, the triple statement is indirectly supported by this sentence because it suggests that there is a specific structural region in CYP2C9 that is responsible for its interaction with ibuprofen, diclofenac, and tolbutamide, and that this region can be modified to alter the enzyme's activity towards these substrates, which implies that ibuprofen is indeed a substrate of CYP2C9, as stated in the triple statement."
21639719,Ibuprofen affects UGT2B7,1023,"Glucuronidation of 20-HETE by UGT2B7 and UGT1A9 recombinant enzymes was significantly inhibited by indomethacin, mefanemic acid, diclofenac, ibuprofen, naproxen, and celecoxib (P < 0.001).",True,"Is the triple 'Ibuprofen affects UGT2B7' supported by the sentence: 'Glucuronidation of 20-HETE by UGT2B7 and UGT1A9 recombinant enzymes was significantly inhibited by indomethacin, mefanemic acid, diclofenac, ibuprofen, naproxen, and celecoxib (P < 0.001).'?","Yes, the statement is indirectly supported, as it suggests that ibuprofen inhibits the glucuronidation of 20-HETE by UGT2B7, which implies that ibuprofen does affect UGT2B7. However, it does not explicitly state that ibuprofen has a direct effect on UGT2B7."
21070788,Ibuprofen affects PTGS2,1024,"Thus, selective COX-2 inhibition can significantly reduce the adverse effects including GI tract damage and hepatotoxic effects of traditional NSAIDs like aspirin, ibuprofen, etc.",True,"Is the triple 'Ibuprofen affects PTGS2' supported by the sentence: 'Thus, selective COX-2 inhibition can significantly reduce the adverse effects including GI tract damage and hepatotoxic effects of traditional NSAIDs like aspirin, ibuprofen, etc.'?","Yes, it is indirectly supported. The sentence suggests that traditional NSAIDs like ibuprofen can cause adverse effects such as GI tract damage and hepatotoxic effects. It also suggests that selective COX-2 inhibitors (which do not affect PTGS2) can reduce these adverse effects. Therefore, it could be inferred that ibuprofen's effects on PTGS2 contribute to its adverse effects. However, this is an inference based on the provided sentence; for a direct statement, you would need a sentence that explicitly states the relationship between ibuprofen, PTGS2, and its adverse effects."
21070788,Ibuprofen affects PTGS2,1025,"Thus, selective COX-2 inhibition can significantly reduce the adverse effects including GI tract damage and hepatotoxic effects of traditional NSAIDs like aspirin, ibuprofen, etc.",True,"Is the triple 'Ibuprofen affects PTGS2' supported by the sentence: 'Thus, selective COX-2 inhibition can significantly reduce the adverse effects including GI tract damage and hepatotoxic effects of traditional NSAIDs like aspirin, ibuprofen, etc.'?","Yes, it is indirectly supported because it mentions ibuprofen as a traditional NSAID that has adverse effects such as GI tract damage and hepatotoxic effects, which suggests that ibuprofen does affect biological systems (PTGS2 in this case), but it does not explicitly state that ibuprofen affects PTGS2."
17790144,Ibuprofen affects ASIC1,1026,"Taken together, our data showed that amiloride, PcTX1, and ibuprofen decreased ASIC protein expression and thereby exerted protective effects from ASIC inhibition-mediated cell damage.",True,"Is the triple 'Ibuprofen affects ASIC1' supported by the sentence: 'Taken together, our data showed that amiloride, PcTX1, and ibuprofen decreased ASIC protein expression and thereby exerted protective effects from ASIC inhibition-mediated cell damage.'?","Yes, the statement does provide indirect support for the idea that ibuprofen affects ASIC1. The sentence mentions that ibuprofen decreases ASIC protein expression, which implies it has an effect on ASIC1 since it's a type of ASIC protein. However, it's important to note that this is an indirect inference based on a general statement about ASIC proteins, not a direct statement about ibuprofen's effect on ASIC1 specifically."
16185008,Ibuprofen affects UGT2B17,1027,"Previous reports have revealed that non-steroidal, anti-inflammatory drugs, diclofenac and ibuprofen, inhibit the UGT2B17 enzyme.",True,"Is the triple 'Ibuprofen affects UGT2B17' supported by the sentence: 'Previous reports have revealed that non-steroidal, anti-inflammatory drugs, diclofenac and ibuprofen, inhibit the UGT2B17 enzyme.'?","Yes, the statement does support it indirectly, as it suggests that ibuprofen can inhibit the UGT2B17 enzyme, implying an effect on it."
15736170,Ibuprofen affects CYP2D6,1028,"Quinidine, fluoxetine, fluvoxamine, and ibuprofen were chosen to represent impurities as they inhibit CYP2D6 to varying degrees.",True,"Is the triple 'Ibuprofen affects CYP2D6' supported by the sentence: 'Quinidine, fluoxetine, fluvoxamine, and ibuprofen were chosen to represent impurities as they inhibit CYP2D6 to varying degrees.'?","Yes, the statement does support that ibuprofen inhibits CYP2D6 to a certain degree, thus providing indirect evidence that it could affect CYP2D6 activity."
15311951,Ibuprofen affects CYP2C19,1029,"Interactions described include those between aspirin and ibuprofen, aspirin and other nonsteroidal anti-inflammatory drugs (NSAIDs), and the thienopyridine, clopidogrel, and drugs inhibiting CYP2C19, notably the proton pump inhibitors (PPI) omeprazole and esomeprazole.",True,"Is the triple 'Ibuprofen affects CYP2C19' supported by the sentence: 'Interactions described include those between aspirin and ibuprofen, aspirin and other nonsteroidal anti-inflammatory drugs (NSAIDs), and the thienopyridine, clopidogrel, and drugs inhibiting CYP2C19, notably the proton pump inhibitors (PPI) omeprazole and esomeprazole.'?","Yes, it is indirectly supported. The sentence mentions interactions between ibuprofen, other NSAIDs, and drugs inhibiting CYP2C19, which includes omeprazole and esomeprazole. This suggests that ibuprofen could potentially affect CYP2C19, although it's not explicitly stated in this sentence."
13056328,Ibuprofen affects FAAH,1030,"Ibu-am5 inhibited the binding of [3H]-CP55,940 to rat brain CB1 and human CB2 cannabinoid receptors more potently than ibuprofen, but the increase in potency was less than the corresponding increase in potency seen for inhibition of FAAH activity.",True,"Is the triple 'Ibuprofen affects FAAH' supported by the sentence: 'Ibu-am5 inhibited the binding of [3H]-CP55,940 to rat brain CB1 and human CB2 cannabinoid receptors more potently than ibuprofen, but the increase in potency was less than the corresponding increase in potency seen for inhibition of FAAH activity.'?","Yes, the triple statement ""Ibuprofen affects FAAH"" is indirectly supported by this sentence. The sentence mentions that Ibu-am5, a derivative of ibuprofen, affects the CB1 and CB2 cannabinoid receptors, which are known to be regulated by fatty acid amide hydrolase (FAAH). Therefore, it can be inferred that ibuprofen may also have an effect on FAAH, but this is not explicitly stated in the sentence."
