Predicate ID,Triple,Sentence ID,Sentence,Question,Label,Reference
10240036,Prednisolone prevents Inflammation,341,CONCLUSIONS: Predocol is an oral preparation of a poorly absorbed salt of prednisolone that is effective in reducing inflammation over short treatment periods in patients with active ulcerative colitis.,"Is the triple ""Prednisolone prevents Inflammation"" supported by the sentence: ""CONCLUSIONS: Predocol is an oral preparation of a poorly absorbed salt of prednisolone that is effective in reducing inflammation over short treatment periods in patients with active ulcerative colitis.""?",False,
18452194,Prednisolone exacerbates ulcerative colitis,342,"Six weeks prior to his symptoms, prednisolone (PSL) and SASP had been started because of UC aggravation.","Is the triple ""Prednisolone exacerbates ulcerative colitis"" supported by the sentence: ""Six weeks prior to his symptoms, prednisolone (PSL) and SASP had been started because of UC aggravation.""?",False,
25753407,Prednisolone predisposes neoplasm,343,"When comparing organ specific, age-adjusted expected versus observed incidences after natural death of animals an increased tumor risk was found in organ systems of all treatment modalities but prednisolone.","Is the triple ""Prednisolone predisposes neoplasm"" supported by the sentence: ""When comparing organ specific, age-adjusted expected versus observed incidences after natural death of animals an increased tumor risk was found in organ systems of all treatment modalities but prednisolone.""?",False,
16546227,Prednisolone predisposes pneumonia,344,"R-CHOP chemotherapy composed of rituximab, cyclophosphamide, adriamycin, vincristine, and prednisolone which might increase the risk of Pneumocystis pneumonia in patients with non-Hodgkin lymphoma.","Is the triple ""Prednisolone predisposes pneumonia"" supported by the sentence: ""R-CHOP chemotherapy composed of rituximab, cyclophosphamide, adriamycin, vincristine, and prednisolone which might increase the risk of Pneumocystis pneumonia in patients with non-Hodgkin lymphoma.""?",False,
27027571,Hydrocortisone related to HIV infectious disease,345,"Cortisol deficiency is common in late stage HIV disease, but symptoms of fatigue and postural hypotension, as well as biochemical findings, are poor predictors of cortisol deficiency.","Is the triple ""Hydrocortisone related to HIV infectious disease"" supported by the sentence: ""Cortisol deficiency is common in late stage HIV disease, but symptoms of fatigue and postural hypotension, as well as biochemical findings, are poor predictors of cortisol deficiency.""?",False,
25927636,Hydrocortisone related to cardiac arrest,346,[Plasma cortisol and 17-ketosteroids in urine in relation to cardiac arrest].,"Is the triple ""Hydrocortisone related to cardiac arrest"" supported by the sentence: ""[Plasma cortisol and 17-ketosteroids in urine in relation to cardiac arrest].""?",False,
25797574,Hydrocortisone related to lymphoma,347,"Independence of theta and TL surface antigens and killing by thymidine, cortisol, phytohemagglutinin, and cyclic AMP in a murine lymphoma.","Is the triple ""Hydrocortisone related to lymphoma"" supported by the sentence: ""Independence of theta and TL surface antigens and killing by thymidine, cortisol, phytohemagglutinin, and cyclic AMP in a murine lymphoma.""?",False,
25131277,Hydrocortisone related to Crohn disease,348,"Furthermore, this treatment process demonstrated the superior anti-inflammatory effect of prednisolone over that of hydrocortisone and supported the assumption of inflammation related to CD.","Is the triple ""Hydrocortisone related to Crohn disease"" supported by the sentence: ""Furthermore, this treatment process demonstrated the superior anti-inflammatory effect of prednisolone over that of hydrocortisone and supported the assumption of inflammation related to CD.""?",False,
19793698,Hydrocortisone related to alcohol abuse,349,"Ordinary least squared (OLS) regression was used to evaluate whether race moderated the associations between alcohol abuse and four biomarkers-urinary cortisol and serum dehydroepiandrosterone sulfate (DHEA-S), epinephrine and norepinephrine-and two composite summary scores, each consisting of two components that characterize the hypothalamic pituitary adrenal (HPA)-axis and sympathetic nervous systems (SNS), respectively.","Is the triple ""Hydrocortisone related to alcohol abuse"" supported by the sentence: ""Ordinary least squared (OLS) regression was used to evaluate whether race moderated the associations between alcohol abuse and four biomarkers-urinary cortisol and serum dehydroepiandrosterone sulfate (DHEA-S), epinephrine and norepinephrine-and two composite summary scores, each consisting of two components that characterize the hypothalamic pituitary adrenal (HPA)-axis and sympathetic nervous systems (SNS), respectively.""?",False,
19531872,Hydrocortisone related to atrial fibrillation,350,"CONCLUSION: In patients with septic shock, low-dose hydrocortisone was associated with a lower risk of developing AF during the acute phase.","Is the triple ""Hydrocortisone related to atrial fibrillation"" supported by the sentence: ""CONCLUSION: In patients with septic shock, low-dose hydrocortisone was associated with a lower risk of developing AF during the acute phase.""?",False,
18705900,Hydrocortisone related to phobic disorder,351,"The incidence of psychological symptoms as somatization, obsessive-compulsive symptoms, depression, anxiety, phobia, and nonspecific symptoms is statistically increased in pregnant women with elevated morning cortisol, but in women with elevated afternoon cortisol also occurring aggressiveness and paranoia.","Is the triple ""Hydrocortisone related to phobic disorder"" supported by the sentence: ""The incidence of psychological symptoms as somatization, obsessive-compulsive symptoms, depression, anxiety, phobia, and nonspecific symptoms is statistically increased in pregnant women with elevated morning cortisol, but in women with elevated afternoon cortisol also occurring aggressiveness and paranoia.""?",False,
15155784,Hydrocortisone related to psoriasis,352,How stress gets under the skin: cortisol and stress reactivity in psoriasis.,"Is the triple ""Hydrocortisone related to psoriasis"" supported by the sentence: ""How stress gets under the skin: cortisol and stress reactivity in psoriasis.""?",False,
14891361,"Hydrocortisone related to dermatitis, atopic",353,Absorption of hydrocortisone from the skin reservoir in atopic dermatitis.,"Is the triple ""Hydrocortisone related to dermatitis, atopic"" supported by the sentence: ""Absorption of hydrocortisone from the skin reservoir in atopic dermatitis.""?",False,
14483328,Hydrocortisone related to bronchopulmonary dysplasia,354,OBJECTIVE: To assess dexamethasone (DEX) and hydrocortisone (HC) use in premature infants over time and the association of steroid use with the incidence of bronchopulmonary dysplasia (BPD) at 36 weeks' postmenstrual age.,"Is the triple ""Hydrocortisone related to bronchopulmonary dysplasia"" supported by the sentence: ""OBJECTIVE: To assess dexamethasone (DEX) and hydrocortisone (HC) use in premature infants over time and the association of steroid use with the incidence of bronchopulmonary dysplasia (BPD) at 36 weeks' postmenstrual age.""?",False,
14450267,Hydrocortisone related to adrenal cortex neoplasm,355,Increased ratio of mRNA expression of the genes CYP17 and CYP11B1 indicates autonomous cortisol production in adrenocortical tumors.,"Is the triple ""Hydrocortisone related to adrenal cortex neoplasm"" supported by the sentence: ""Increased ratio of mRNA expression of the genes CYP17 and CYP11B1 indicates autonomous cortisol production in adrenocortical tumors.""?",False,
14387016,Hydrocortisone related to cirrhosis of liver,356,"It is concluded that bile acids are potent endogenous inhibitors of 11 beta-HSD and, therefore, could participate in abnormalities of cortisol metabolism observed in liver cirrhosis and extrahepatic biliary obstruction and, possibly, after ingestion of bile acids.","Is the triple ""Hydrocortisone related to cirrhosis of liver"" supported by the sentence: ""It is concluded that bile acids are potent endogenous inhibitors of 11 beta-HSD and, therefore, could participate in abnormalities of cortisol metabolism observed in liver cirrhosis and extrahepatic biliary obstruction and, possibly, after ingestion of bile acids.""?",False,
14360687,Hydrocortisone related to dermatitis,357,"The plasma cortisol concentration was significantly higher in both DD groups before treatment than in the control group, and it decreased significantly after hoof trimming in the trimmed group.","Is the triple ""Hydrocortisone related to dermatitis"" supported by the sentence: ""The plasma cortisol concentration was significantly higher in both DD groups before treatment than in the control group, and it decreased significantly after hoof trimming in the trimmed group.""?",False,
13844584,Hydrocortisone related to acute myeloid leukemia,358,Hydrocortisone in culture protects the blast cells in acute myeloblastic leukemia from the lethal effects of cytosine arabinoside.,"Is the triple ""Hydrocortisone related to acute myeloid leukemia"" supported by the sentence: ""Hydrocortisone in culture protects the blast cells in acute myeloblastic leukemia from the lethal effects of cytosine arabinoside.""?",False,
13213365,Hydrocortisone related to chronic primary adrenal insufficiency,359,Continuous subcutaneous hydrocortisone infusion in Addison's disease.,"Is the triple ""Hydrocortisone related to chronic primary adrenal insufficiency"" supported by the sentence: ""Continuous subcutaneous hydrocortisone infusion in Addison's disease.""?",False,
12756660,Hydrocortisone related to borderline personality disorder,360,The current findings underline the relevance of cortisol and DHEA assessments and the need for further scrutiny of their interplay to foster our understanding of the biological basis of stress regulation in BPD.,"Is the triple ""Hydrocortisone related to borderline personality disorder"" supported by the sentence: ""The current findings underline the relevance of cortisol and DHEA assessments and the need for further scrutiny of their interplay to foster our understanding of the biological basis of stress regulation in BPD.""?",False,
12576998,Hydrocortisone related to Hypoxemia,361,"This hypoxia-specific increase in surface beta-adrenoreceptors was significantly enhanced in the cortisol-treated erythrocytes, showing that cortisol had a significant impact on erythrocyte beta-adrenoreceptor dynamics in addition to the direct influence of hypoxia.","Is the triple ""Hydrocortisone related to Hypoxemia"" supported by the sentence: ""This hypoxia-specific increase in surface beta-adrenoreceptors was significantly enhanced in the cortisol-treated erythrocytes, showing that cortisol had a significant impact on erythrocyte beta-adrenoreceptor dynamics in addition to the direct influence of hypoxia.""?",False,
11888652,Hydrocortisone related to congenital adrenal hyperplasia,362,"Congenital adrenal hyperplasia (CAH) due to deficiency of 21-hydroxylase is a disorder of the adrenal cortex characterised by cortisol deficiency, with or without aldosterone deficiency, and androgen excess.","Is the triple ""Hydrocortisone related to congenital adrenal hyperplasia"" supported by the sentence: ""Congenital adrenal hyperplasia (CAH) due to deficiency of 21-hydroxylase is a disorder of the adrenal cortex characterised by cortisol deficiency, with or without aldosterone deficiency, and androgen excess.""?",False,
11866289,Hydrocortisone related to nicotine dependence,363,"Changes of smoking behavior and serum adrenocorticotropic hormone, cortisol, prolactin, and endogenous opioids levels in nicotine dependence after naltrexone treatment.","Is the triple ""Hydrocortisone related to nicotine dependence"" supported by the sentence: ""Changes of smoking behavior and serum adrenocorticotropic hormone, cortisol, prolactin, and endogenous opioids levels in nicotine dependence after naltrexone treatment.""?",False,
11530989,Hydrocortisone related to pneumonia,364,We hypothesize that hydrocortisone infusion in severe community-acquired pneumonia attenuates systemic inflammation and leads to earlier resolution of pneumonia and a reduction in sepsis-related complications.,"Is the triple ""Hydrocortisone related to pneumonia"" supported by the sentence: ""We hypothesize that hydrocortisone infusion in severe community-acquired pneumonia attenuates systemic inflammation and leads to earlier resolution of pneumonia and a reduction in sepsis-related complications.""?",False,
11442939,Hydrocortisone related to prostate cancer,365,A prospective study was performed to investigate the combination of the aromatase inhibitor aminoglutethimide and hydrocortisone in androgen-independent prostate cancer with changes in prostate-specific antigen (PSA) level as main determinant for response.,"Is the triple ""Hydrocortisone related to prostate cancer"" supported by the sentence: ""A prospective study was performed to investigate the combination of the aromatase inhibitor aminoglutethimide and hydrocortisone in androgen-independent prostate cancer with changes in prostate-specific antigen (PSA) level as main determinant for response.""?",False,
11089023,Hydrocortisone related to pancreatitis,366,"To investigate the time courses of the effects of the exogenous glucocorticoid agonists dexamethasone (DEX) and hydrocortisone (HYD) and a glucocorticoid antagonist (RU-38486), and to characterize the local and systemic responses in experimental AP.","Is the triple ""Hydrocortisone related to pancreatitis"" supported by the sentence: ""To investigate the time courses of the effects of the exogenous glucocorticoid agonists dexamethasone (DEX) and hydrocortisone (HYD) and a glucocorticoid antagonist (RU-38486), and to characterize the local and systemic responses in experimental AP.""?",False,
10649902,Hydrocortisone related to myocardial infarction,367,[The adrenal cortex and hydrocortisone metabolism in experimental myocardial infarct].,"Is the triple ""Hydrocortisone related to myocardial infarction"" supported by the sentence: ""[The adrenal cortex and hydrocortisone metabolism in experimental myocardial infarct].""?",False,
10522181,Hydrocortisone related to osteoarthritis,368,[Intraarticular hydrocortisone (cortril) in arthritis and osteoarthritis].,"Is the triple ""Hydrocortisone related to osteoarthritis"" supported by the sentence: ""[Intraarticular hydrocortisone (cortril) in arthritis and osteoarthritis].""?",False,
10521296,Hydrocortisone related to eye disorder,369,[Use of cortisone and hydrocortisone in eye diseases].,"Is the triple ""Hydrocortisone related to eye disorder"" supported by the sentence: ""[Use of cortisone and hydrocortisone in eye diseases].""?",False,
10518203,Hydrocortisone related to otitis externa,370,[Topical use of hydrocortisone in otitis externa].,"Is the triple ""Hydrocortisone related to otitis externa"" supported by the sentence: ""[Topical use of hydrocortisone in otitis externa].""?",False,
10484611,Hydrocortisone related to ulcerative colitis,371,The use of hydrocortisone in ulcerative colitis:  preliminary observations.,"Is the triple ""Hydrocortisone related to ulcerative colitis"" supported by the sentence: ""The use of hydrocortisone in ulcerative colitis:  preliminary observations.""?",False,
9718673,Hydrocortisone related to atopic eczema,372,It can therefore be concluded that ointments containing either only E. coli BCS or a combination of BCS and hydrocortisone provide significant relief in perianal eczema as well as in early stages of hemorrhoidal disease.,"Is the triple ""Hydrocortisone related to atopic eczema"" supported by the sentence: ""It can therefore be concluded that ointments containing either only E. coli BCS or a combination of BCS and hydrocortisone provide significant relief in perianal eczema as well as in early stages of hemorrhoidal disease.""?",False,
9492934,Hydrocortisone related to opiate dependence,373,The effect on cortisol supports the above conclusion and is consistent with HPA axis perturbation in opioid dependence as reported in other studies and extends these observations to stable methadone-maintained patients.,"Is the triple ""Hydrocortisone related to opiate dependence"" supported by the sentence: ""The effect on cortisol supports the above conclusion and is consistent with HPA axis perturbation in opioid dependence as reported in other studies and extends these observations to stable methadone-maintained patients.""?",False,
9238280,Hydrocortisone related to Sepsis,374,Several randomized controlled trials have evaluated the efficacy of a replacement therapy with hydrocortisone in severe sepsis.,"Is the triple ""Hydrocortisone related to Sepsis"" supported by the sentence: ""Several randomized controlled trials have evaluated the efficacy of a replacement therapy with hydrocortisone in severe sepsis.""?",False,
9235597,Hydrocortisone related to type 1 diabetes mellitus,375,[Diurnal variations in blood glucose and plasma cortisol in juvenile diabetes mellitus without ketoacidosis].,"Is the triple ""Hydrocortisone related to type 1 diabetes mellitus"" supported by the sentence: ""[Diurnal variations in blood glucose and plasma cortisol in juvenile diabetes mellitus without ketoacidosis].""?",False,
8977987,Hydrocortisone related to injury,376,"OBJECTIVES: Elderly women with proximal femur fracture show abnormal persistence of increased cortisol concentrations, which could contribute to the high morbidity associated with this injury.","Is the triple ""Hydrocortisone related to injury"" supported by the sentence: ""OBJECTIVES: Elderly women with proximal femur fracture show abnormal persistence of increased cortisol concentrations, which could contribute to the high morbidity associated with this injury.""?",False,
8778414,Hydrocortisone related to Inflammation,377,"From the compendium presented above, the following statements become evident: 1) Inappropriately low secretion of cortisol in relation to inflammation is a typical feature of the inflammatory disease in patients with RA.","Is the triple ""Hydrocortisone related to Inflammation"" supported by the sentence: ""From the compendium presented above, the following statements become evident: 1) Inappropriately low secretion of cortisol in relation to inflammation is a typical feature of the inflammatory disease in patients with RA.""?",False,
8763179,Hydrocortisone related to toxic shock syndrome,378,Hydrocortisone infusion in septic shock differentially regulated the cytokine responses.,"Is the triple ""Hydrocortisone related to toxic shock syndrome"" supported by the sentence: ""Hydrocortisone infusion in septic shock differentially regulated the cytokine responses.""?",False,
8625521,Hydrocortisone related to dissociative amnesia,379,"BACKGROUND: There is substantial evidence of dysregulation of cortisol secretion, hippocampal abnormalities, and memory deficits in schizophrenia and other psychotic disorders.","Is the triple ""Hydrocortisone related to dissociative amnesia"" supported by the sentence: ""BACKGROUND: There is substantial evidence of dysregulation of cortisol secretion, hippocampal abnormalities, and memory deficits in schizophrenia and other psychotic disorders.""?",False,
8615164,Hydrocortisone related to asthma,380,(2) One of the mechanisms of therapeutic effect of cortisol in asthma might be its inhibitory effect on CA uptake.,"Is the triple ""Hydrocortisone related to asthma"" supported by the sentence: ""(2) One of the mechanisms of therapeutic effect of cortisol in asthma might be its inhibitory effect on CA uptake.""?",False,
8570630,Hydrocortisone related to fibromyalgia,381,"OBJECTIVE: To compare cortisol levels, diurnal cycles of cortisol, and reactivity of cortisol to psychological stress in fibromyalgia (FM) and rheumatoid arthritis (RA) patients in their natural environment, and to examine the effect on results of accounting for differences among the groups in psychological stress and other lifestyle and psychosocial variables.","Is the triple ""Hydrocortisone related to fibromyalgia"" supported by the sentence: ""OBJECTIVE: To compare cortisol levels, diurnal cycles of cortisol, and reactivity of cortisol to psychological stress in fibromyalgia (FM) and rheumatoid arthritis (RA) patients in their natural environment, and to examine the effect on results of accounting for differences among the groups in psychological stress and other lifestyle and psychosocial variables.""?",False,
8017438,Hydrocortisone related to Insulin resistance,382,"OBJECTIVES: Recent data suggest that higher plasma cortisol may be associated with hypertension and insulin resistance in otherwise healthy men, as it is in Cushing's syndrome.","Is the triple ""Hydrocortisone related to Insulin resistance"" supported by the sentence: ""OBJECTIVES: Recent data suggest that higher plasma cortisol may be associated with hypertension and insulin resistance in otherwise healthy men, as it is in Cushing's syndrome.""?",False,
7919367,Hydrocortisone related to adrenocortical insufficiency,383,"These findings demonstrate 2 types of adrenal insufficiency with different clinical pictures: Type 1 is characterized by cortisol deficiency with hypoglycaemia, low corticoid levels and a low cortisol secretion rate; Type 2 shows aldosterone deficiency with prominent salt loss.","Is the triple ""Hydrocortisone related to adrenocortical insufficiency"" supported by the sentence: ""These findings demonstrate 2 types of adrenal insufficiency with different clinical pictures: Type 1 is characterized by cortisol deficiency with hypoglycaemia, low corticoid levels and a low cortisol secretion rate; Type 2 shows aldosterone deficiency with prominent salt loss.""?",False,
7573954,Hydrocortisone related to neoplasm,384,"November, a period of reproductive quiescence in the southern hemisphere, with new antler growth and rapid weight gain, is associated with higher mean plasma cortisol concentrations and a greater responsiveness to exogenous ACTH.","Is the triple ""Hydrocortisone related to neoplasm"" supported by the sentence: ""November, a period of reproductive quiescence in the southern hemisphere, with new antler growth and rapid weight gain, is associated with higher mean plasma cortisol concentrations and a greater responsiveness to exogenous ACTH.""?",False,
7182905,Hydrocortisone related to obesity disorder,385,Cortisol metabolism in human obesity: impaired cortisone-->cortisol conversion in subjects with central adiposity.,"Is the triple ""Hydrocortisone related to obesity disorder"" supported by the sentence: ""Cortisol metabolism in human obesity: impaired cortisone-->cortisol conversion in subjects with central adiposity.""?",False,
24445107,Hydrocortisone related to Inflammation,386,The hypothalamic-pituitary-adrenal (HPA) axis is one of the key physiological systems that counterbalances this systemic inflammation through changes in adrenocorticotrophic hormone (ACTH) and cortisol.,"Is the triple ""Hydrocortisone related to Inflammation"" supported by the sentence: ""The hypothalamic-pituitary-adrenal (HPA) axis is one of the key physiological systems that counterbalances this systemic inflammation through changes in adrenocorticotrophic hormone (ACTH) and cortisol.""?",False,
24030854,Hydrocortisone related to Hypoxemia,387,"The 5 dpf hypoxic exposure also elicited transient increases in whole body cortisol and in crf, uts1, and hsd20b2 expression, key regulators of the endocrine stress response.","Is the triple ""Hydrocortisone related to Hypoxemia"" supported by the sentence: ""The 5 dpf hypoxic exposure also elicited transient increases in whole body cortisol and in crf, uts1, and hsd20b2 expression, key regulators of the endocrine stress response.""?",False,
12533519,Hydrocortisone related to Insulin resistance,388,"At multiple regression analyses, HOMA-IR on admission in the IR group significantly correlated with thyroid-stimulating hormone, glucagon, and cortisol.","Is the triple ""Hydrocortisone related to Insulin resistance"" supported by the sentence: ""At multiple regression analyses, HOMA-IR on admission in the IR group significantly correlated with thyroid-stimulating hormone, glucagon, and cortisol.""?",False,
27747116,Hydrocortisone causes toxic shock syndrome,389,"The suppression of the anti-inflammatory effects of cortisol as a result of states of excessive stress leads to hypercatabolic diseases such as AIDS, sepsis and toxic shock syndrome and protein calorie malnutrition (NAIDS).","Is the triple ""Hydrocortisone causes toxic shock syndrome"" supported by the sentence: ""The suppression of the anti-inflammatory effects of cortisol as a result of states of excessive stress leads to hypercatabolic diseases such as AIDS, sepsis and toxic shock syndrome and protein calorie malnutrition (NAIDS).""?",False,
27747115,Hydrocortisone causes Sepsis,390,"The suppression of the anti-inflammatory effects of cortisol as a result of states of excessive stress leads to hypercatabolic diseases such as AIDS, sepsis and toxic shock syndrome and protein calorie malnutrition (NAIDS).","Is the triple ""Hydrocortisone causes Sepsis"" supported by the sentence: ""The suppression of the anti-inflammatory effects of cortisol as a result of states of excessive stress leads to hypercatabolic diseases such as AIDS, sepsis and toxic shock syndrome and protein calorie malnutrition (NAIDS).""?",False,
