Predicate ID,Triple,Sentence ID,Sentence,Question,Label,Reference
14636779,Methylprednisolone treats neoplasm,1260,"Rats with stereotactically implanted Walker 256 tumors were treated with methylprednisolone, U-74006F, U-78517F, or vehicle (0.05 N HCl) on Days 6 through 10 following implantation.","Is the triple ""Methylprednisolone treats neoplasm"" supported by the sentence: ""Rats with stereotactically implanted Walker 256 tumors were treated with methylprednisolone, U-74006F, U-78517F, or vehicle (0.05 N HCl) on Days 6 through 10 following implantation.""?",True,
14398238,Methylprednisolone treats IgA glomerulonephritis,1261,"CONCLUSIONS: Methylprednisolone and cyclophosphamide in children with Grade IV IgA nephropathy stabilized renal function and significantly reduced hematuria, proteinuria, mesangial IgA deposition, and the renal pathological activity index.","Is the triple ""Methylprednisolone treats IgA glomerulonephritis"" supported by the sentence: ""CONCLUSIONS: Methylprednisolone and cyclophosphamide in children with Grade IV IgA nephropathy stabilized renal function and significantly reduced hematuria, proteinuria, mesangial IgA deposition, and the renal pathological activity index.""?",True,
14232595,Methylprednisolone treats membranous glomerulonephritis,1262,"MN was treated with methylprednisolone as first-line therapy, then she was changed to rituximab for a relapse.","Is the triple ""Methylprednisolone treats membranous glomerulonephritis"" supported by the sentence: ""MN was treated with methylprednisolone as first-line therapy, then she was changed to rituximab for a relapse.""?",True,
14027935,Methylprednisolone treats diffuse large B-cell lymphoma,1263,"This study evaluated the influence of prior exposure to rituximab on response rates and survival in patients with diffuse large B-cell lymphoma treated with rituximab plus etoposide, cytarabine, cisplatinum and methylprednisolone (R-ESHAP).","Is the triple ""Methylprednisolone treats diffuse large B-cell lymphoma"" supported by the sentence: ""This study evaluated the influence of prior exposure to rituximab on response rates and survival in patients with diffuse large B-cell lymphoma treated with rituximab plus etoposide, cytarabine, cisplatinum and methylprednisolone (R-ESHAP).""?",True,
13679356,Methylprednisolone treats hemophagocytic syndrome,1264,"A 46 year old woman who presented with severe multiorgans involvement including liver brain, cardio-pulmonary failure, gastrointestinal bleeding, progressive cytopenia, DIC and hemophagocytic syndrome during the convalescent phase of Dengue type II has been successfully treated primarily with pulse methyl prednisolone and high dose intravenous immunoglobulin G.","Is the triple ""Methylprednisolone treats hemophagocytic syndrome"" supported by the sentence: ""A 46 year old woman who presented with severe multiorgans involvement including liver brain, cardio-pulmonary failure, gastrointestinal bleeding, progressive cytopenia, DIC and hemophagocytic syndrome during the convalescent phase of Dengue type II has been successfully treated primarily with pulse methyl prednisolone and high dose intravenous immunoglobulin G.""?",True,
13619118,Methylprednisolone treats chronic obstructive pulmonary disease,1265,"In conclusion, methylprednisolone in combination with conventional medical therapy not only improved lung function values but also mean nocturnal oxyhemoglobin saturation and sleep duration in clinically stabilized COPD patients who experience nocturnal oxyhemoglobin desaturation.","Is the triple ""Methylprednisolone treats chronic obstructive pulmonary disease"" supported by the sentence: ""In conclusion, methylprednisolone in combination with conventional medical therapy not only improved lung function values but also mean nocturnal oxyhemoglobin saturation and sleep duration in clinically stabilized COPD patients who experience nocturnal oxyhemoglobin desaturation.""?",True,
13533673,Methylprednisolone treats macrophage activation syndrome,1266,"Following treatment with etanercept, ibuprofen, methylprednisolone, and phenylbutazone for 3 weeks, MAS deteriorated and fatal cerebral edema occurred within only 24 h.","Is the triple ""Methylprednisolone treats macrophage activation syndrome"" supported by the sentence: ""Following treatment with etanercept, ibuprofen, methylprednisolone, and phenylbutazone for 3 weeks, MAS deteriorated and fatal cerebral edema occurred within only 24 h.""?",True,
13161419,Methylprednisolone treats systemic sclerosis,1267,"CONCLUSION: The results of this pilot study suggest that the combination of MMF, IV MP and low-dose GC might achieve good clinical, functional and radiological results in patients suffering from severe early SSc.","Is the triple ""Methylprednisolone treats systemic sclerosis"" supported by the sentence: ""CONCLUSION: The results of this pilot study suggest that the combination of MMF, IV MP and low-dose GC might achieve good clinical, functional and radiological results in patients suffering from severe early SSc.""?",True,
13096165,Methylprednisolone treats optic nerve disorder,1268,"Dysthyroid optic neuropathy is best treated with intravenous pulsed methylprednisolone; if visual functions do not recover, urgent surgical decompression is indicated.","Is the triple ""Methylprednisolone treats optic nerve disorder"" supported by the sentence: ""Dysthyroid optic neuropathy is best treated with intravenous pulsed methylprednisolone; if visual functions do not recover, urgent surgical decompression is indicated.""?",True,
12975348,Methylprednisolone treats mature T-cell and NK-cell non-Hodgkin lymphoma,1269,"Gemcitabine, cisplatin and methylprednisolone for the treatment of patients with peripheral T-cell lymphoma: the Royal Marsden Hospital experience.","Is the triple ""Methylprednisolone treats mature T-cell and NK-cell non-Hodgkin lymphoma"" supported by the sentence: ""Gemcitabine, cisplatin and methylprednisolone for the treatment of patients with peripheral T-cell lymphoma: the Royal Marsden Hospital experience.""?",True,
12450216,Methylprednisolone treats bronchopulmonary dysplasia,1270,Hypertrophic cardiomyopathy in preterm infants treated with methylprednisolone for bronchopulmonary dysplasia.,"Is the triple ""Methylprednisolone treats bronchopulmonary dysplasia"" supported by the sentence: ""Hypertrophic cardiomyopathy in preterm infants treated with methylprednisolone for bronchopulmonary dysplasia.""?",True,
11895116,Methylprednisolone treats plasma cell myeloma,1271,Multiple myeloma of Stage IIa was diagnosed and she was given cytostatic therapy with 17.5 mg melphalan and 112 mg methylprednisolone daily by mouth (for 4 days at intervals of 6 weeks).,"Is the triple ""Methylprednisolone treats plasma cell myeloma"" supported by the sentence: ""Multiple myeloma of Stage IIa was diagnosed and she was given cytostatic therapy with 17.5 mg melphalan and 112 mg methylprednisolone daily by mouth (for 4 days at intervals of 6 weeks).""?",True,
11882768,Methylprednisolone treats Cognitive impairment,1272,One-year cyclophosphamide treatment combined with methylprednisolone improves cognitive dysfunction in progressive forms of multiple sclerosis.,"Is the triple ""Methylprednisolone treats Cognitive impairment"" supported by the sentence: ""One-year cyclophosphamide treatment combined with methylprednisolone improves cognitive dysfunction in progressive forms of multiple sclerosis.""?",True,
11547088,Methylprednisolone treats thrombotic thrombocytopenic purpura,1273,"The hematologic evaluations and her clinical course revealed the diagnosis of TTP, so plasma exchange and methyl-prednisolone therapy were initiated.","Is the triple ""Methylprednisolone treats thrombotic thrombocytopenic purpura"" supported by the sentence: ""The hematologic evaluations and her clinical course revealed the diagnosis of TTP, so plasma exchange and methyl-prednisolone therapy were initiated.""?",True,
11313619,Methylprednisolone treats vestibular neuronitis,1274,"METHODS: We performed a prospective, randomized, double-blind, two-by-two factorial trial in which patients with acute vestibular neuritis were randomly assigned to treatment with placebo, methylprednisolone, valacyclovir, or methylprednisolone plus valacyclovir.","Is the triple ""Methylprednisolone treats vestibular neuronitis"" supported by the sentence: ""METHODS: We performed a prospective, randomized, double-blind, two-by-two factorial trial in which patients with acute vestibular neuritis were randomly assigned to treatment with placebo, methylprednisolone, valacyclovir, or methylprednisolone plus valacyclovir.""?",True,
10801960,Methylprednisolone treats B-cell chronic lymphocytic leukemia,1275,High dose methylprednisolone can induce remissions in CLL patients with p53 abnormalities.,"Is the triple ""Methylprednisolone treats B-cell chronic lymphocytic leukemia"" supported by the sentence: ""High dose methylprednisolone can induce remissions in CLL patients with p53 abnormalities.""?",True,
10634179,Methylprednisolone treats Crohn disease,1276,An example of acute pancreatitis developing five weeks after initial treatment with 5-aminosalicylic acid (5-ASA) and methylprednisolone for severe Crohn's disease is reported in a 37 year old female patient.,"Is the triple ""Methylprednisolone treats Crohn disease"" supported by the sentence: ""An example of acute pancreatitis developing five weeks after initial treatment with 5-aminosalicylic acid (5-ASA) and methylprednisolone for severe Crohn's disease is reported in a 37 year old female patient.""?",True,
10341065,Methylprednisolone treats severe acute respiratory syndrome,1277,Twenty-nine of the 30 SARS patients were treated by methylprednisolone.,"Is the triple ""Methylprednisolone treats severe acute respiratory syndrome"" supported by the sentence: ""Twenty-nine of the 30 SARS patients were treated by methylprednisolone.""?",True,
10289517,Methylprednisolone treats graft versus host disease,1278,"CASE SUMMARY: A 2-year-old white boy with a history of relapsed acute lymphoblastic leukemia underwent a bone marrow transplant and developed graft-versus-host disease, which was treated with methylprednisolone.","Is the triple ""Methylprednisolone treats graft versus host disease"" supported by the sentence: ""CASE SUMMARY: A 2-year-old white boy with a history of relapsed acute lymphoblastic leukemia underwent a bone marrow transplant and developed graft-versus-host disease, which was treated with methylprednisolone.""?",True,
10221573,Methylprednisolone treats myeloproliferative neoplasm,1279,The effects of HDMP should be explored in patients with other subtypes of AML who present with MT.,"Is the triple ""Methylprednisolone treats myeloproliferative neoplasm"" supported by the sentence: ""The effects of HDMP should be explored in patients with other subtypes of AML who present with MT.""?",True,
10136260,Methylprednisolone treats acute lymphoblastic leukemia,1280,"We examined the effect of high-dose methylprednisolone (HDMP) on blast reduction rate and compared it to conventional dose steroid treatment, administered during the first 7+ days of the induction remission period in patients with acute lymphoblastic leukemia (ALL).","Is the triple ""Methylprednisolone treats acute lymphoblastic leukemia"" supported by the sentence: ""We examined the effect of high-dose methylprednisolone (HDMP) on blast reduction rate and compared it to conventional dose steroid treatment, administered during the first 7+ days of the induction remission period in patients with acute lymphoblastic leukemia (ALL).""?",True,
10049014,"Methylprednisolone treats dermatitis, atopic",1281,"The objective of this multicentre, parallel, blinded, randomized controlled study was to evaluate the efficacy and the safety of cyclosporine (CsA group, 117 dogs) in comparison with methylprednisolone (MP group, 59 dogs) in the treatment of atopic dermatitis for 4 months.","Is the triple ""Methylprednisolone treats dermatitis, atopic"" supported by the sentence: ""The objective of this multicentre, parallel, blinded, randomized controlled study was to evaluate the efficacy and the safety of cyclosporine (CsA group, 117 dogs) in comparison with methylprednisolone (MP group, 59 dogs) in the treatment of atopic dermatitis for 4 months.""?",True,
9980473,Methylprednisolone treats immunoglobulin a vasculitis,1282,"CASE DESCRIPTION: A 33-year-old woman previously treated with methylprednisolone and cyclophosphamide for Henoch-Schonlein purpura was transferred from a referring hospital because of sore throat, fever, and chills.","Is the triple ""Methylprednisolone treats immunoglobulin a vasculitis"" supported by the sentence: ""CASE DESCRIPTION: A 33-year-old woman previously treated with methylprednisolone and cyclophosphamide for Henoch-Schonlein purpura was transferred from a referring hospital because of sore throat, fever, and chills.""?",True,
9720542,Methylprednisolone treats lupus nephritis,1283,The last significant breakthrough in the treatment of systemic lupus erythematosus (SLE) was the use of cyclophosphamide and methylprednisolone in the treatment of lupus nephritis.,"Is the triple ""Methylprednisolone treats lupus nephritis"" supported by the sentence: ""The last significant breakthrough in the treatment of systemic lupus erythematosus (SLE) was the use of cyclophosphamide and methylprednisolone in the treatment of lupus nephritis.""?",True,
8761529,Methylprednisolone treats asthma,1284,Methylprednisolone suleptanate (Promedrol) is a prodrug of methylprednisolone being developed by Pharmacia Corp (formerly Pharmacia & Upjohn) for the treatment of asthma.,"Is the triple ""Methylprednisolone treats asthma"" supported by the sentence: ""Methylprednisolone suleptanate (Promedrol) is a prodrug of methylprednisolone being developed by Pharmacia Corp (formerly Pharmacia & Upjohn) for the treatment of asthma.""?",True,
8588816,Methylprednisolone treats Bell's palsy,1285,"On these basis, we have studied the efficacity of parenteral association of 30 mg/Kg/j of Aciclovir and 1 mg/Kg/j of Methylprednisolone in the treatment of Bell's palsy with less than 12 days of evolution.","Is the triple ""Methylprednisolone treats Bell's palsy"" supported by the sentence: ""On these basis, we have studied the efficacity of parenteral association of 30 mg/Kg/j of Aciclovir and 1 mg/Kg/j of Methylprednisolone in the treatment of Bell's palsy with less than 12 days of evolution.""?",True,
8568939,Methylprednisolone treats myasthenia gravis,1286,"Treatment with methylprednisolone for myasthenia gravis was associated with a marked decrease in both biochemical markers of bone formation and resorption without any changes in endogenous cAMP and serum levels of calcium, PTH, and 1,25-dihydroxyvitamin D3 [1,25-(OH)2D3].","Is the triple ""Methylprednisolone treats myasthenia gravis"" supported by the sentence: ""Treatment with methylprednisolone for myasthenia gravis was associated with a marked decrease in both biochemical markers of bone formation and resorption without any changes in endogenous cAMP and serum levels of calcium, PTH, and 1,25-dihydroxyvitamin D3 [1,25-(OH)2D3].""?",True,
8562694,Methylprednisolone treats endocrine exophthalmos,1287,PATIENTS AND METHODS: Fourteen euthyroid patients with severe Graves' ophthalmopathy were treated with high-dose intravenous methylprednisolone during 6 months and followed-up for 24-48 months by clinical and ophthalmological assessment.,"Is the triple ""Methylprednisolone treats endocrine exophthalmos"" supported by the sentence: ""PATIENTS AND METHODS: Fourteen euthyroid patients with severe Graves' ophthalmopathy were treated with high-dose intravenous methylprednisolone during 6 months and followed-up for 24-48 months by clinical and ophthalmological assessment.""?",True,
8503951,Methylprednisolone treats ulcerative colitis,1288,The current study evaluated the efficacy and safety of unfractionated heparin in the treatment of ulcerative colitis in comparison with methylprednisolone.,"Is the triple ""Methylprednisolone treats ulcerative colitis"" supported by the sentence: ""The current study evaluated the efficacy and safety of unfractionated heparin in the treatment of ulcerative colitis in comparison with methylprednisolone.""?",True,
8464737,Methylprednisolone treats kidney disorder,1289,"Post partum acute renal failure and type IV lupus nephropathy were treated with hemodialysis, methylprednisolone, cyclophosphamide and prednisone.","Is the triple ""Methylprednisolone treats kidney disorder"" supported by the sentence: ""Post partum acute renal failure and type IV lupus nephropathy were treated with hemodialysis, methylprednisolone, cyclophosphamide and prednisone.""?",True,
8427466,Methylprednisolone treats sinusitis,1290,"To resolve the controversy over whether corticosteroids promote or inhibit the resolution of sinusitis, we present a prospective study of 80 rabbits with surgically introduced pseudomonal sinusitis that were then treated in one of four arms: control, ceftazidime, methylprednisolone, and ceftazidime with methylprednisolone.","Is the triple ""Methylprednisolone treats sinusitis"" supported by the sentence: ""To resolve the controversy over whether corticosteroids promote or inhibit the resolution of sinusitis, we present a prospective study of 80 rabbits with surgically introduced pseudomonal sinusitis that were then treated in one of four arms: control, ceftazidime, methylprednisolone, and ceftazidime with methylprednisolone.""?",True,
8330903,Methylprednisolone treats systemic lupus erythematosus,1291,MAIN RESULTS: We found no randomised controlled trials comparing cyclophosphamide versus methylprednisolone for the treatment of neuropsychiatric involvement in the systemic lupus erythematosus.,"Is the triple ""Methylprednisolone treats systemic lupus erythematosus"" supported by the sentence: ""MAIN RESULTS: We found no randomised controlled trials comparing cyclophosphamide versus methylprednisolone for the treatment of neuropsychiatric involvement in the systemic lupus erythematosus.""?",True,
8291810,Methylprednisolone treats pneumonia,1292,High-dose methylprednisolone was administered for treatment of the pneumonitis.,"Is the triple ""Methylprednisolone treats pneumonia"" supported by the sentence: ""High-dose methylprednisolone was administered for treatment of the pneumonitis.""?",True,
8227578,Methylprednisolone treats mucocutaneous lymph node syndrome,1293,"Additional antiinflammatory therapy, such as IV methylprednisolone and IV cyclophosphamide, may be helpful in treating persistent KD.","Is the triple ""Methylprednisolone treats mucocutaneous lymph node syndrome"" supported by the sentence: ""Additional antiinflammatory therapy, such as IV methylprednisolone and IV cyclophosphamide, may be helpful in treating persistent KD.""?",True,
8095661,Methylprednisolone treats carpal tunnel syndrome,1294,Injection with methylprednisolone for carpal tunnel syndrome.,"Is the triple ""Methylprednisolone treats carpal tunnel syndrome"" supported by the sentence: ""Injection with methylprednisolone for carpal tunnel syndrome.""?",True,
8083160,Methylprednisolone treats thrombocytopenia,1295,"After a course of high-dose methylprednisolone therapy with a diagnosis of Evans syndrome, complete response for thrombocytopenia and partial response for anemia was achieved.","Is the triple ""Methylprednisolone treats thrombocytopenia"" supported by the sentence: ""After a course of high-dose methylprednisolone therapy with a diagnosis of Evans syndrome, complete response for thrombocytopenia and partial response for anemia was achieved.""?",True,
8063034,Methylprednisolone treats granulomatosis with polyangiitis,1296,We describe a 44-year-old man with Wegener's granulomatosis who was treated with cyclophosphamide and methylprednisolone and who subsequently developed bilateral CMVR.,"Is the triple ""Methylprednisolone treats granulomatosis with polyangiitis"" supported by the sentence: ""We describe a 44-year-old man with Wegener's granulomatosis who was treated with cyclophosphamide and methylprednisolone and who subsequently developed bilateral CMVR.""?",True,
8018847,Methylprednisolone treats Pain,1297,A comparative trial of botulinum toxin type A and methylprednisolone for the treatment of myofascial pain syndrome and pain from chronic muscle spasm.,"Is the triple ""Methylprednisolone treats Pain"" supported by the sentence: ""A comparative trial of botulinum toxin type A and methylprednisolone for the treatment of myofascial pain syndrome and pain from chronic muscle spasm.""?",True,
7905007,Methylprednisolone treats chronic progressive multiple sclerosis,1298,OBJECTIVE: To determine if there are variables linked to responsiveness to pulse cyclophosphamide/methylprednisolone therapy in progressive Multiple Sclerosis (MS).,"Is the triple ""Methylprednisolone treats chronic progressive multiple sclerosis"" supported by the sentence: ""OBJECTIVE: To determine if there are variables linked to responsiveness to pulse cyclophosphamide/methylprednisolone therapy in progressive Multiple Sclerosis (MS).""?",True,
7853881,Methylprednisolone treats rheumatoid arthritis,1299,Oral low-dose glucocorticosteroids as compared with intravenous methylprednisolone pulses in the treatment of rheumatoid arthritis.,"Is the triple ""Methylprednisolone treats rheumatoid arthritis"" supported by the sentence: ""Oral low-dose glucocorticosteroids as compared with intravenous methylprednisolone pulses in the treatment of rheumatoid arthritis.""?",True,
7827490,Methylprednisolone treats optic neuritis,1300,CONCLUSIONS: The ONTT has led to a dramatic reduction in the use of oral prednisone without a preceding course of intravenous methylprednisolone in the treatment of acute optic neuritis.,"Is the triple ""Methylprednisolone treats optic neuritis"" supported by the sentence: ""CONCLUSIONS: The ONTT has led to a dramatic reduction in the use of oral prednisone without a preceding course of intravenous methylprednisolone in the treatment of acute optic neuritis.""?",True,
7808987,Methylprednisolone treats autoimmune thrombocytopenic purpura,1301,CONCLUSION: A short intravenous course of high-dose methylprednisolone is effective as initial treatment of adults with ITP.,"Is the triple ""Methylprednisolone treats autoimmune thrombocytopenic purpura"" supported by the sentence: ""CONCLUSION: A short intravenous course of high-dose methylprednisolone is effective as initial treatment of adults with ITP.""?",True,
7700869,Methylprednisolone treats Edema,1302,"Lipid peroxidation and oedema in experimental brain injury: comparison of treatment with methylprednisolone, tirilazad mesylate and vitamin E.","Is the triple ""Methylprednisolone treats Edema"" supported by the sentence: ""Lipid peroxidation and oedema in experimental brain injury: comparison of treatment with methylprednisolone, tirilazad mesylate and vitamin E.""?",True,
7668594,Methylprednisolone treats multiple sclerosis,1303,The same determinations were repeated on plasma and on CSF samples that were collected after the MS patients had ended a six-day treatment with high-dose methylprednisolone (MP).,"Is the triple ""Methylprednisolone treats multiple sclerosis"" supported by the sentence: ""The same determinations were repeated on plasma and on CSF samples that were collected after the MS patients had ended a six-day treatment with high-dose methylprednisolone (MP).""?",True,
7649490,Methylprednisolone treats aplastic anemia,1304,"Neutropenic infections are the major cause of morbidity and mortality in the treatment of aplastic anemia (AA) with antilymphocyte globulin (ALG), cyclosporin A (CSA), and methylprednisolone (MP).","Is the triple ""Methylprednisolone treats aplastic anemia"" supported by the sentence: ""Neutropenic infections are the major cause of morbidity and mortality in the treatment of aplastic anemia (AA) with antilymphocyte globulin (ALG), cyclosporin A (CSA), and methylprednisolone (MP).""?",True,
7552935,Methylprednisolone treats Inflammation,1305,Methylprednisolone treatment resulted in the greatest reduction in the inflammatory cell infiltrate but the numbers of infected neurons did not increase concomitantly.,"Is the triple ""Methylprednisolone treats Inflammation"" supported by the sentence: ""Methylprednisolone treatment resulted in the greatest reduction in the inflammatory cell infiltrate but the numbers of infected neurons did not increase concomitantly.""?",True,
7483648,Methylprednisolone treats adult acute respiratory distress syndrome,1306,Severe systemic inflammatory response syndrome with shock and ARDS resulting from Still's disease: clinical response with high-dose pulse methylprednisolone therapy.,"Is the triple ""Methylprednisolone treats adult acute respiratory distress syndrome"" supported by the sentence: ""Severe systemic inflammatory response syndrome with shock and ARDS resulting from Still's disease: clinical response with high-dose pulse methylprednisolone therapy.""?",True,
7432980,Methylprednisolone treats myelodysplastic syndrome,1307,Eosinophilic fasciitis associated with autoimmune thyroid disease and myelodysplasia treated with pulsed methylprednisolone and antihistamines.,"Is the triple ""Methylprednisolone treats myelodysplastic syndrome"" supported by the sentence: ""Eosinophilic fasciitis associated with autoimmune thyroid disease and myelodysplasia treated with pulsed methylprednisolone and antihistamines.""?",True,
16097513,Cefotaxime treats osteomyelitis,1308,Cefotaxime in the treatment of chronic osteomyelitis caused by gram-negative bacilli.,"Is the triple ""Cefotaxime treats osteomyelitis"" supported by the sentence: ""Cefotaxime in the treatment of chronic osteomyelitis caused by gram-negative bacilli.""?",True,
